day,slot_time,slot_name,slot_presentation_count,slot_cross_platform_count,presentation_id,presentation_number,posterboard_number,title,session_title,start,affiliation,products,source_keywords,presentation_url
Apr 21,2:00 PM,Afternoon,89,12,6200,6158,16,Senescent tumor-associated macrophages promote peritoneal metastatic niche formation in gastric cancer,Metastatic Niches and Microenvironment,4/21/2026 2:00:00 PM,"Indiana University School of Medicine, Indianapolis, IN | The Cancer Institute, Japanese Foundation for Cancer Research, Tokyo, Japan",Visium,Visium; 10X,https://www.abstractsonline.com/pp8/#!/21436/presentation/6200
Apr 21,2:00 PM,Afternoon,89,12,8061,6187,1,Elevating bulk sequencing with high-resolution spatial transcriptomics: A paired-data analysis of clinically-relevant spatial niches in CRC and NSCLC,Spatial Niches and Functional Boundaries within the Tumor Microenvironment 2,4/21/2026 2:00:00 PM,"Tempus AI, Chicago, IL",Visium,Visium; 10X,https://www.abstractsonline.com/pp8/#!/21436/presentation/8061
Apr 21,2:00 PM,Afternoon,89,12,8063,6189,3,ERBB2 expression and the immune landscape shape the tumor microenvironment and influence prognosis in esophageal adenocarcinoma brain metastases,Spatial Niches and Functional Boundaries within the Tumor Microenvironment 2,4/21/2026 2:00:00 PM,"Neurosurgery, UT MD Anderson Cancer Center, Houston, TX | Genetics, UT MD Anderson Cancer Center, Houston, TX | Genomic Medicine, UT MD Anderson Cancer Center, Houston, TX",Xenium,Xenium; 10X,https://www.abstractsonline.com/pp8/#!/21436/presentation/8063
Apr 21,2:00 PM,Afternoon,89,12,8072,6194,8,Spatial architecture of immunochemotherapy response in pleural mesothelioma,Spatial Niches and Functional Boundaries within the Tumor Microenvironment 2,4/21/2026 2:00:00 PM,"Department of Medical Science, Graduate School, The Catholic University of Korea, Seoul, Korea, Republic of | Department of Hospital Pathology, Seoul St. Mary’s Hospital, The Catholic University of Korea, Seoul, Korea, Republic of | Division of Oncology, Department of Internal Medicine, Seoul St. Mary's Hospital, The Catholic University of Korea, Seoul, Korea, Republic of | Department of Pathology, Korea University Anam Hospital, College of Medicine, Korea University, Seoul, Korea, Republic of",Xenium,Xenium; Xenium + 5K,https://www.abstractsonline.com/pp8/#!/21436/presentation/8072
Apr 21,2:00 PM,Afternoon,89,12,8073,6195,9,Spatial transcriptomics analysis reveals tumor cell plasticity and diverse tumor microenvironments in Ewing sarcoma,Spatial Niches and Functional Boundaries within the Tumor Microenvironment 2,4/21/2026 2:00:00 PM,"Division of Artificial Intelligence in Oncology, DKFZ German Cancer Research Center, Heidelberg, Germany | Division of Translational Pediatric Sarcoma Research, DKFZ German Cancer Research Center, Heidelberg, Germany | Gerhard-Domagk-Institute of Pathology, Münster University Hospital, Muenster, Germany | Pediatrics III, University Hospital Essen, West German Cancer Center, NCT West, Essen, Germany | Division of Regulatory Genomics and Cancer Evolution, DKFZ German Cancer Research Center, Heidelberg, Germany",Xenium,Xenium; 10X,https://www.abstractsonline.com/pp8/#!/21436/presentation/8073
Apr 21,2:00 PM,Afternoon,89,12,8077,6199,13,Spatially revealed malignant and microenvironment ecosystems in PanIN- and IPMN-derived PDAC,Spatial Niches and Functional Boundaries within the Tumor Microenvironment 2,4/21/2026 2:00:00 PM,"School of Cancer Science, Univ. of Glasgow, Glasgow, United Kingdom | Department of Surgery, Erasmus Medical Center, Rotterdam, Netherlands | School of Infection and Immunity, Univ. of Glasgow, Glasgow, United Kingdom | Pathology and Clinical Bioinformatics, Erasmus Medical Centre, Rotterdam, Netherlands",CosMx,CosMx; Bruker,https://www.abstractsonline.com/pp8/#!/21436/presentation/8077
Apr 21,2:00 PM,Afternoon,89,12,8080,6201,15,PaintScapeTM enables multiomic in-situ direct visualization of spatial 3D genome architecture of single cells in intact fresh frozen Glioblastoma tissue in native tumor microenvironments,Spatial Niches and Functional Boundaries within the Tumor Microenvironment 2,4/21/2026 2:00:00 PM,"NYU Langone Health, New York, NY | Bruker Spatial Genomics, San Jose, CA",PaintScape,PaintScape; Bruker,https://www.abstractsonline.com/pp8/#!/21436/presentation/8080
Apr 21,2:00 PM,Afternoon,89,12,8168,6204,18,Spatial transcriptomic dissection of TSC-associated angiomyolipoma reveals microenvironmental programs driven by mTORC1 dysregulation,Spatial Niches and Functional Boundaries within the Tumor Microenvironment 2,4/21/2026 2:00:00 PM,"Department of Urology, Ehime University Graduate School of Medicine, Toon, Japan | Department of Analytical Pathology, Ehime University Graduate School of Medicine, Toon, Japan | Division of Diagnostic Pathology, Ehime University Hospital, Toon, Japan",Visium,Visium; 10X,https://www.abstractsonline.com/pp8/#!/21436/presentation/8168
Apr 21,2:00 PM,Afternoon,89,12,8169,6205,19,Establishing reproducibility standards for Xenium spatial transcriptomics through multi-replicate validation and cross-sectional analysis,Spatial Niches and Functional Boundaries within the Tumor Microenvironment 2,4/21/2026 2:00:00 PM,"BioChain Institute, Inc., Newark, CA",Xenium,Xenium; 10X,https://www.abstractsonline.com/pp8/#!/21436/presentation/8169
Apr 21,2:00 PM,Afternoon,89,12,10533,6208,22,Subcellular imaging of murine models of metastatic colorectal cancer using a whole transcriptome spatial molecular imaging panel,Spatial Niches and Functional Boundaries within the Tumor Microenvironment 2,4/21/2026 2:00:00 PM,"Bruker Spatial Biology, Seattle, WA | Cancer Research UK Scotland Institute, Glasgow, United Kingdom",CosMx,CosMx; Bruker,https://www.abstractsonline.com/pp8/#!/21436/presentation/10533
Apr 21,2:00 PM,Afternoon,89,12,10824,6211,25,AI-guided spatial multi-omics integration reveals immune and stromal heterogeneity underlying population disparities in prostate cancer.,Spatial Niches and Functional Boundaries within the Tumor Microenvironment 2,4/21/2026 2:00:00 PM,"Pathology, Johns Hopkins University School of Medicine, Baltimore, MD",Visium,Visium; 10X,https://www.abstractsonline.com/pp8/#!/21436/presentation/10824
Apr 21,2:00 PM,Afternoon,89,12,10837,6214,28,Mapping the tumor landscape: spatial multiomics reveals immune and stromal heterogeneity across early and late-stage NSCLC,Spatial Niches and Functional Boundaries within the Tumor Microenvironment 2,4/21/2026 2:00:00 PM,"Nikon Bioimaging Lab, Nikon Instruments Inc, Lexington, MA",Visium,Visium; 10X,https://www.abstractsonline.com/pp8/#!/21436/presentation/10837
Apr 21,2:00 PM,Afternoon,89,12,5886,6447,14,FOLFIRINOX plus nivolumab promotes plasma cell production from intra-tumoral lymphoid aggregates in borderline resectable pancreatic adenocarcinoma,Biostatistics in Clinical Trials / Surgical Oncology,4/21/2026 2:00:00 PM,"Surgery, UCLA Medical Center, Los Angeles, CA | UCLA David Geffen School of Medicine, Los Angeles, CA | Pathology, UCLA Medical Center, Los Angeles, CA | Medicine, UCLA Medical Center, Los Angeles, CA",Xenium,Xenium; 10X,https://www.abstractsonline.com/pp8/#!/21436/presentation/5886
Apr 21,2:00 PM,Afternoon,89,12,9522,6478,26,Temporal dynamics of T cell reprogramming associate with clinical response to ICI-based combination therapy in metastatic renal cell carcinoma,Clinical Correlates of Immunotherapy,4/21/2026 2:00:00 PM,"Department of Health Sciences and Technology, Samsung Advanced Institute of Health Sciences and Technology (SAIHST), Seoul, Korea, Republic of | UNC Lineberger Comprehensive Cancer Center, Chapel Hill, NC | UNC Chapel Hill, Cary, NC | Department of Health Sciences and Technology, Samsung Advanced Institute of Health Sciences and Technology (SAIHST)Samsung Medical Center, Seoul, Korea, Republic of",Xenium,Xenium; Xenium + 5K,https://www.abstractsonline.com/pp8/#!/21436/presentation/9522
Apr 21,2:00 PM,Afternoon,89,12,9562,6573,6,Assessment of the T cell receptor repertoire in racially diverse prostate cancer patients,"Inflammation, Immunity, and Cancer",4/21/2026 2:00:00 PM,"Surgery, Center for Prostate Disease Research, Bethesda, MD",Xenium,Xenium; 10X,https://www.abstractsonline.com/pp8/#!/21436/presentation/9562
Apr 21,2:00 PM,Afternoon,89,12,10056,6662,4,Spatial genomics reveals microenvironmental programs associated with organ-specific metastatic propensity in prostate cancer,Spatial Proteomics and Transcriptomics 3,4/21/2026 2:00:00 PM,"Cedars-Sinai Medical Center, Los Angeles, CA",Xenium,Xenium; 10X,https://www.abstractsonline.com/pp8/#!/21436/presentation/10056
Apr 21,2:00 PM,Afternoon,89,12,10057,6663,5,Integrated spatial transcriptomic and proteomic profiling reveals tumor-immune niches driving heterogeneity and resistance in clear cell renal cell carcinoma,Spatial Proteomics and Transcriptomics 3,4/21/2026 2:00:00 PM,"Standard BioTools, Markham, ON, Canada",Xenium,Xenium; Xenium + 5K,https://www.abstractsonline.com/pp8/#!/21436/presentation/10057
Apr 21,2:00 PM,Afternoon,89,12,10058,6664,6,Single-cell spatial proteomics of 1200+ protein targets in tumor microenvironments from diverse cancers using GeoMx Discovery Proteome Atlas,Spatial Proteomics and Transcriptomics 3,4/21/2026 2:00:00 PM,"Research and Development, Bruker Spatial Biology, Seattle, WA",GeoMx,GeoMx; Bruker,https://www.abstractsonline.com/pp8/#!/21436/presentation/10058
Apr 21,2:00 PM,Afternoon,89,12,10068,6672,14,Expanding the boundaries of spatial proteomics with a universal antibody labeling strategy and EpicIF™ multiplexing chemistry,Spatial Proteomics and Transcriptomics 3,4/21/2026 2:00:00 PM,"Bruker Spatial Biology, St. Louis, MO",CellScape,CellScape; Bruker,https://www.abstractsonline.com/pp8/#!/21436/presentation/10068
Apr 21,2:00 PM,Afternoon,89,12,10073,6678,20,Ultra-high-plex immunofluorescence analysis of the tumor-immune microenvironment with EpicIF technology on the CellScape platform,Spatial Proteomics and Transcriptomics 3,4/21/2026 2:00:00 PM,"Bruker Spatial Biology, St. Louis, MO | Dept. of Pathology, University Medical Center Schleswig-Holstein, Kiel, Germany",CellScape,CellScape; Bruker,https://www.abstractsonline.com/pp8/#!/21436/presentation/10073
Apr 21,2:00 PM,Afternoon,89,12,9707,6718,29,Identifying new cell surface markers of T-cell reactivity through single cell transcriptomic analysis,Vaccines and Other Immunomodulatory Agents,4/21/2026 2:00:00 PM,"NIH-NCI, Bethesda, MD | Laboratory of Integrative Cancer Immunology (LICI), Center for Cancer Research, Bethesda, MD | National Cancer Institute, Bethesda, MD | National Institutes for Health, Bethesda, MD | Surgery Branch, NIH-NCI, Bethesda, MD | Surgery Branch, National Cancer Institute, Bethesda, MD",Chromium,Chromium; 10X,https://www.abstractsonline.com/pp8/#!/21436/presentation/9707
Apr 21,2:00 PM,Afternoon,89,12,3049,5436,3,Spatial identification of hypoxic and normoxic dormancy hotspots predicting in her2-positive and metastatic breast cancer,Application of Bioinformatics to Cancer Biology 5,4/21/2026 2:00:00 PM,"Department of Medical Research, Taichung Veterans General Hospital, Taichung City, Taiwan | Graduate School of Advanced Technology, National Taiwan University, Taipei City, Taiwan | Greehey Children's Cancer Research Institute, UT Health San Antonio, San Antonio, TX",Visium,Visium,https://www.abstractsonline.com/pp8/#!/21436/presentation/3049
Apr 21,2:00 PM,Afternoon,89,12,3062,5450,17,Decoding ADC payload dynamics with a spatial transcriptomics-integrated tumor microenvironment PK model,Application of Bioinformatics to Cancer Biology 5,4/21/2026 2:00:00 PM,"Portrai, Inc., Seoul, Korea, Republic of",Visium,Visium,https://www.abstractsonline.com/pp8/#!/21436/presentation/3062
Apr 21,2:00 PM,Afternoon,89,12,2664,5491,4,AI foundation model for single cell annotation from conventional histopathology images of cancer,Machine Learning for Image Analysis,4/21/2026 2:00:00 PM,"Stanford University, Stanford, CA | The University of Queensland, Queensland, Australia",Xenium,Xenium,https://www.abstractsonline.com/pp8/#!/21436/presentation/2664
Apr 21,2:00 PM,Afternoon,89,12,3239,5505,10,A unified framework for cross-platform spatial omics analysis and deep spatial profiling,New Software Tools for Data Analysis,4/21/2026 2:00:00 PM,"Department of Genomic Medicine, The University of Texas MD Anderson Cancer Center, Houston, TX | Department of Translational Molecular Pathology,, The University of Texas MD Anderson Cancer Center, Houston, TX | Instituto Metropole Digital (IMD), Universidade Federal do Rio Grande do Norte (UFRN), Natal, Brazil | The University of Texas MD Anderson Cancer Center, Houston, TX | University of Pennsylvania, Philadelphia, PA",Visium,Visium,https://www.abstractsonline.com/pp8/#!/21436/presentation/3239
Apr 21,2:00 PM,Afternoon,89,12,4523,5535,7,"GPRC5D multispecific antibodies: Engineering for affinity, cross-species reactivity, and bi/trispecific engagement in multiple myeloma",Bi- and Tri-Specific Antibody Therapies,4/21/2026 2:00:00 PM,"Integral Molecular, Philadelphia, PA",Antibody Discovery,Antibody Discovery,https://www.abstractsonline.com/pp8/#!/21436/presentation/4523
Apr 21,2:00 PM,Afternoon,89,12,1378,5573,16,Novel ASPORIN/CRABP2 axis drives cell-state plasticity from adenocarcinoma to neuroendocrine-like prostate cancer,Oncogenic Pathways and Cancer Immunity,4/21/2026 2:00:00 PM,"Biochemistry and Molecular Biology, University of Nebraska Medical Center, Omaha, NE",Incucyte,Incucyte,https://www.abstractsonline.com/pp8/#!/21436/presentation/1378
Apr 21,2:00 PM,Afternoon,89,12,4551,5613,5,RenTCR-derived MAGEA1-specific TCRs demonstrated superior peptide sensitivity and potent antitumor activity in vitro and in vivo,TCR and Autologous T Cell Therapies,4/21/2026 2:00:00 PM,"Biocytogen, Waltham, MA",TCR Discovery,TCR Discovery,https://www.abstractsonline.com/pp8/#!/21436/presentation/4551
Apr 21,2:00 PM,Afternoon,89,12,4558,5614,6,RenTCR-derived natural MAGE-A4-specific TCRs outperformed affinity-enhanced TCRs in antitumor efficacy,TCR and Autologous T Cell Therapies,4/21/2026 2:00:00 PM,"Biocytogen, Waltham, MA",TCR Discovery,TCR Discovery,https://www.abstractsonline.com/pp8/#!/21436/presentation/4558
Apr 21,2:00 PM,Afternoon,89,12,5213,5616,8,Tumor necrosis factor-alpha armed TCR-T and CAR-T cells for solid tumors provide superior anticancer activity in the absence of toxicity,TCR and Autologous T Cell Therapies,4/21/2026 2:00:00 PM,"UCLA - University of California Los Angeles, Los Angeles, CA | Pediatric Oncology, University of California, Los Angeles, Los Angeles, CA | University of California, Los Angeles, Los Angeles, CA",CosMx,CosMx,https://www.abstractsonline.com/pp8/#!/21436/presentation/5213
Apr 21,2:00 PM,Afternoon,89,12,5229,5619,11,First-in-class anaplastic lymphoma kinase (ALK)-specific TCR-T cells induce potent and selective antitumor immunity across ALK-driven human cancers,TCR and Autologous T Cell Therapies,4/21/2026 2:00:00 PM,"Pathology, Boston Children's Hospital, Boston, MA | Universitá Degli Studi di Torino, Turin, Italy | Lowe Center Thoracic Oncology, Dana Farber Cancer Institute, Boston, MA | Department of Medical Oncology, Dana Farber Cancer Institute, Boston, MA",TCR Discovery,TCR Discovery,https://www.abstractsonline.com/pp8/#!/21436/presentation/5229
Apr 21,2:00 PM,Afternoon,89,12,3474,5691,7,Per and polyfluoroalkyl substances (PFAS) promote proliferation and migration in genetically distinct kidney cancer cell lines,Mechanisms of Anticancer Drug Action,4/21/2026 2:00:00 PM,"Center for Immunotherapy and Precision Immuno-oncology, Cleveland Clinic Lerner Research Institute, Cleveland, OH | Department of Bioengineering,, University of Illinois Urbana-Champaign, Champaign, IL | Glickman Urological and Kidney Institute, Cleveland Clinic, Cleveland, OH | Department of Cancer Biology, Cleveland Clinic Research, Cleveland, OH",Incucyte,Incucyte,https://www.abstractsonline.com/pp8/#!/21436/presentation/3474
Apr 21,2:00 PM,Afternoon,89,12,3514,5697,13,EZH2 inhibition upregulates GD2 to enhance anti-GD2 immunotherapy in Ewing sarcoma,Mechanisms of Anticancer Drug Action,4/21/2026 2:00:00 PM,"Atrium Health Wake Forest Baptist Comprehensive Cancer Center, Charlotte, NC",Incucyte,Incucyte,https://www.abstractsonline.com/pp8/#!/21436/presentation/3514
Apr 21,2:00 PM,Afternoon,89,12,4706,5731,20,ID4 maintains undifferentiated and immune-evasive states in aggressive triple-negative breast cancer and represents a novel druggable vulnerability,Molecular Targets 2,4/21/2026 2:00:00 PM,"IHEM-CONICET, Mendoza, Argentina | FCM-UNCuyo, Mendoza, Argentina | RWTH Aachen University Hospital, Aachen, Germany",Incucyte,Incucyte,https://www.abstractsonline.com/pp8/#!/21436/presentation/4706
Apr 21,2:00 PM,Afternoon,89,12,3916,5821,15,Utilize a soluble T-cell receptor TCR targeting tumor intracellular antigen PRAME to develop therapeutic and radioactive diagnostic agents for PRAME-positive tumors,Radiopharmacuetical Platforms for Theranostic Precision Oncology,4/21/2026 2:00:00 PM,"Suzhou Hepius Therapeutics, Suzhou, China | Suzhou Hepius Therapeutics Co, Suzhou, China",TCR Discovery,TCR Discovery,https://www.abstractsonline.com/pp8/#!/21436/presentation/3916
Apr 21,2:00 PM,Afternoon,89,12,7454,6046,23,Spatial transcriptomic profiling of cancer-associated fibroblast niches in extrahepatic cholangiocarcinoma,Fibroblasts as Architects of the Tumor Microenvironment,4/21/2026 2:00:00 PM,"Department of Experimental and Clinical Medicine, Università degli Studi di Firenze - UniFI (University of Florence), Firenze, Italy | Department of Experimental and Clinical Biomedical Sciences 'Mario Serio', Università degli Studi di Firenze - UniFI (University of Florence), Firenze, Italy | Clinical Oncology Unit, Careggi University Hospital, Firenze, Italy | Department of Medicine, Surgery and Dentistry ""Scuola Medica, Salernitana"", University of Salerno, Salerno, Italy | Department of Experimental and Clinical Medicine, Pathology Unit, Università degli Studi di Firenze - UniFI (University of Florence), Firenze, Italy",GeoMx,GeoMx,https://www.abstractsonline.com/pp8/#!/21436/presentation/7454
Apr 21,2:00 PM,Afternoon,89,12,8494,6051,28,Pancreatic tumor expressed growth factors activate a neural-like program in human fibroblasts which is associated with poor prognosis,Fibroblasts as Architects of the Tumor Microenvironment,4/21/2026 2:00:00 PM,"Institute for Research in Immunology and Cancer (IRIC), Montréal, QC, Canada",Xenium,Xenium,https://www.abstractsonline.com/pp8/#!/21436/presentation/8494
Apr 21,2:00 PM,Afternoon,89,12,7093,6077,23,A natural antibody response associated with improved survival of SCLC patients can be actively induced in a SCLC mouse model and leads to significantly improved survival,"In Vivo Models 2: Genetically Engineered Mouse Models, PDXs, Syngeneic Models",4/21/2026 2:00:00 PM,"USC/Norris Comprehensive Cancer Center, Los Angeles, CA | University of California San Diego, San Diego, CA | USC - University of Southern California, Los Angeles, CA | University of Southern California, Los Angeles, CA | City of Hope Beckman Research Institute, Duarte, CA | Beckman Research Institute of The City of Hope, Glendale, CA | Keck School of Medicine of USC, Los Angeles, CA",Visium,Visium,https://www.abstractsonline.com/pp8/#!/21436/presentation/7093
Apr 21,2:00 PM,Afternoon,89,12,10515,6115,6,Deciphering tumor microenvironment dynamics in tumorigenesis and lymph node metastasis of esophageal squamous cell carcinoma using single-cell and spatial transcriptomics,Metastasis and Organ-Specific Microenvironmental Evolution,4/21/2026 2:00:00 PM,"Department of Thoracic and Cardiovascular Surgery, Yonsei University College of Medicine, Seoul, Korea, Republic of | Department of Pathology, Yonsei University College of Medicine, Seoul, Korea, Republic of | Division of Medical Oncology, Department of Internal Medicine, Yonsei Cancer Center, Yonsei University College of Medicine, Seoul, Korea, Republic of",CosMx,CosMx,https://www.abstractsonline.com/pp8/#!/21436/presentation/10515
Apr 21,2:00 PM,Afternoon,89,12,10516,6116,7,Spatial multi-omics dissection of colorectal cancer micrometastasis,Metastasis and Organ-Specific Microenvironmental Evolution,4/21/2026 2:00:00 PM,"The University of Texas MD Anderson Cancer Center, Houston, TX",Visium,Visium,https://www.abstractsonline.com/pp8/#!/21436/presentation/10516
Apr 21,2:00 PM,Afternoon,89,12,8437,6122,13,Organ-specific immune and metabolic programs shape spatial microenvironments in MSS colorectal cancer metastases,Metastasis and Organ-Specific Microenvironmental Evolution,4/21/2026 2:00:00 PM,"Department of Medical Oncology and Therapeutics Research, City of Hope National Medical Center, Duarte, CA | Department of Immuno-Oncology, Beckman Research Institute of the City of Hope, Duarte, CA | City of Hope National Medical Center, Department of Medical Oncology and Therapeutics Re, CA | City of Hope National Medical Center, Duarte, CA",GeoMx,GeoMx,https://www.abstractsonline.com/pp8/#!/21436/presentation/8437
Apr 21,2:00 PM,Afternoon,89,12,8076,6198,12,Single cell spatial multi-omic characterization of the tumor microenvironment in transformed follicular lymphoma,Spatial Niches and Functional Boundaries within the Tumor Microenvironment 2,4/21/2026 2:00:00 PM,"BC Cancer Agency, Vancouver, BC, Canada | University of British Columbia, Vancouver, BC, Canada",CosMx,CosMx,https://www.abstractsonline.com/pp8/#!/21436/presentation/8076
Apr 21,2:00 PM,Afternoon,89,12,8081,6202,16,Integrated multiomic atlas of pancreatic solid pseudopapillary neoplasms suggests acinar cells as a potential cell-of-origin,Spatial Niches and Functional Boundaries within the Tumor Microenvironment 2,4/21/2026 2:00:00 PM,"Stanford University, Stanford, CA",G4X,G4X,https://www.abstractsonline.com/pp8/#!/21436/presentation/8081
Apr 21,2:00 PM,Afternoon,89,12,8170,6206,20,Spatially resolved cell-cell architecture in WHO grade 4 IDH-wildtype glioblastoma revealed by CosMx 6K discovery panel,Spatial Niches and Functional Boundaries within the Tumor Microenvironment 2,4/21/2026 2:00:00 PM,"Department of Clinical Oncology, School of Clinical Medicine, The University of Hong Kong, Hong Kong, Hong Kong | Centre for Oncology and Immunology, Hong Kong Science Park, Hong Kong, Hong Kong | School of Biomedical Sciences, LKS Faculty of Medicine, The University of Hong Kong, Hong Kong, Hong Kong | Department of Pathology, School of Clinical Medicine,, The University of Hong Kong, Hong Kong, Hong Kong | Department of Surgery, School of Clinical Medicine, The University of Hong Kong, Hong Kong, Hong Kong",CosMx,CosMx,https://www.abstractsonline.com/pp8/#!/21436/presentation/8170
Apr 21,2:00 PM,Afternoon,89,12,1020,6316,2,Accumulation of p21+ cells and enrichment of growth arrest signature in persistent high-grade premalignant lesions,"Genomics, Proteomics, Biomarkers, and Risk Stratification",4/21/2026 2:00:00 PM,"Pulmonary, Allergy and Critical Care Medicine, University of Colorado, Aurora, CO | Genetic and Genome Sciences, Case Western University, Cleveland, OH | Department of Immunology and Microbiology, University of Colorado, Aurora, CO | Department of Pathology, University of Colorado, Aurora, CO | Rocky Mountain Regional Veteran Affairs Medical Center, Aurora, CO",Visium,Visium,https://www.abstractsonline.com/pp8/#!/21436/presentation/1020
Apr 21,2:00 PM,Afternoon,89,12,6497,6412,12,Development of a high-throughput assay platform for the screening of selective integrin inhibitors in cancer,Screening and Technology Advances for Probe and Drug Discovery,4/21/2026 2:00:00 PM,"WuXi AppTec, Shanghai, China",Incucyte,Incucyte,https://www.abstractsonline.com/pp8/#!/21436/presentation/6497
Apr 21,2:00 PM,Afternoon,89,12,5888,6449,16,Adenosine blockade combined with FOLFIRINOX chemotherapy enhances T follicular helper cell function in pancreatic adenocarcinoma draining lymph nodes from mice and humans,Biostatistics in Clinical Trials / Surgical Oncology,4/21/2026 2:00:00 PM,"UCLA Health, Los Angeles, CA | UCLA Dept of Surgery, Los Angeles, CA | UCLA David Geffen School of Medicine, Los Angeles, CA | UCLA Medical Center Santa Monica, Santa Monica, CA | Assistant Professor, Dept. of General Surg., UCLA David Geffen School of Medicine, Los Angeles, CA",Xenium,Xenium,https://www.abstractsonline.com/pp8/#!/21436/presentation/5888
Apr 21,2:00 PM,Afternoon,89,12,9473,6564,30,Spatially resolved immunologic hallmarks of response to neoadjuvant immune checkpoint blockade in metastatic melanoma,Immune Checkpoint Blockade,4/21/2026 2:00:00 PM,"The Jackson Laboratory, Farmington, CT | Moffitt Cancer Center, Tampa, FL | University of South Florida, Tampa, FL | Vizgen, Cambridge, MA | Research Scientist, Moffitt Cancer Center, Tampa, FL",MerFISH,MerFISH,https://www.abstractsonline.com/pp8/#!/21436/presentation/9473
Apr 21,2:00 PM,Afternoon,89,12,9557,6569,2,Single-cell transcriptomics reveal functional interaction between CD4+ T cells and B cells driving the activated peripheral immune phenotype in healthy women living with germline pathogenic BRCA1 variants,"Inflammation, Immunity, and Cancer",4/21/2026 2:00:00 PM,"National Institute of Oncology Hungary, Budapest, Hungary | Hungarian Center of Excellence for Molecular Medicine, Szeged, Hungary",Chromium,Chromium,https://www.abstractsonline.com/pp8/#!/21436/presentation/9557
