day,slot_time,slot_name,slot_presentation_count,slot_cross_platform_count,presentation_id,presentation_number,posterboard_number,title,session_title,start,affiliation,products,source_keywords,presentation_url
Apr 20,2:00 PM,Afternoon,52,6,8532,3886,19,A novel glioblastoma subtype classification using hallmark gene set signatures: Association between poor prognosis and TP53 downstream pathway,Molecular Classification and Tumor Biology in Cancer,4/20/2026 2:00:00 PM,"Department of Biomedical Science, College of Life Science, CHA University, Seongnam-si, Korea, Republic of | Department of Medicine, Hallym University, Chuncheon-si, Korea, Republic of | CHA University, Seoul, Korea, Republic of | 2Department of Neurosurgery, Bundang CHA Medical Center, Seongnam-si, Korea, Republic of | CHA University, Seongnam-si, Korea, Republic of",GeoMx,GeoMx,https://www.abstractsonline.com/pp8/#!/21436/presentation/8532
Apr 20,2:00 PM,Afternoon,52,6,10119,3943,18,"Morphology-derived spindle-cell gene signature in HPV+ HNSCC is linked to pEMT, molecular subtype, HPV integration, and recurrence-free survival",Prognostic Biomarkers 2,4/20/2026 2:00:00 PM,"Department of Computational Medicine and Bioinformatics, University of Michigan Medical School, Ann Arbor, MI | University of Michigan School of Dentistry, Ann Arbor, MI | Department of Computational Medicine and Bioinformatics, University of Michigan Medical School, Ann Arbor, MI | Georgetown University, Washington, DC | Oncology Department, School of Medicine, Georgetown University, Washington, DC | Assistant Professor, Dept. of Bioinformatics, University of Michigan Medical School, Ann Arbor, MI",CosMx,CosMx,https://www.abstractsonline.com/pp8/#!/21436/presentation/10119
Apr 20,2:00 PM,Afternoon,52,6,10027,3950,1,Spatial transcriptomic dissection of microenvironmental drivers of NMIBC progression,Spatial Proteomics and Transcriptomics 2,4/20/2026 2:00:00 PM,"Cedars-Sinai Medical Center, Los Angeles, CA | Tsinghua University, Beijing, China | University of Arizona, Tucson, AZ",Xenium,Xenium,https://www.abstractsonline.com/pp8/#!/21436/presentation/10027
Apr 20,2:00 PM,Afternoon,52,6,10030,3953,4,Assessing the role of immune aggregates as potential biomarkers of immunotherapy response in appendiceal adenocarcinoma (AA) using spatial proteomics,Spatial Proteomics and Transcriptomics 2,4/20/2026 2:00:00 PM,"UT MD Anderson Cancer Center, Houston, TX | Roswell Park Comprehensive Cancer Center, Buffalo, NY",CosMx,CosMx,https://www.abstractsonline.com/pp8/#!/21436/presentation/10030
Apr 20,2:00 PM,Afternoon,52,6,10033,3956,7,Spatial transcriptomic mapping of ER-positive breast tumors reveals immune pathway remodeling and resistance mechanisms following anti-PD-1 therapy,Spatial Proteomics and Transcriptomics 2,4/20/2026 2:00:00 PM,"Ontario Institute for Cancer Research, Toronto, ON, Canada | Ottawa Hospital Research Institute, Ottawa, ON, Canada | Assistant Professor, Dept. of Oncology, Department of Oncology, McMaster University, Hamilton, ON, Canada",CosMx,CosMx,https://www.abstractsonline.com/pp8/#!/21436/presentation/10033
Apr 20,2:00 PM,Afternoon,52,6,10037,3960,11,Spatially resolved transcriptomic signatures of gallbladder carcinogenesis from precursor to undifferentiated stages,Spatial Proteomics and Transcriptomics 2,4/20/2026 2:00:00 PM,"Department of pathology, Korea University Anam Hospital, Seoul, Korea, Republic of | Department of Biomedical Sciences, Yonsei University College of Medicine, Seoul, Korea, Republic of | Department of pathology, Gangnam Severance Hospital, Seoul, Korea, Republic of",GeoMx,GeoMx,https://www.abstractsonline.com/pp8/#!/21436/presentation/10037
Apr 20,2:00 PM,Afternoon,52,6,10038,3961,12,Identifying the molecular signature of infiltrating edge cells in glioblastoma as drivers of tumour invasion and recurrence,Spatial Proteomics and Transcriptomics 2,4/20/2026 2:00:00 PM,"University of Toronto, Toronto, ON, Canada | PMGC, UHN, Toronto, ON, Canada | MD Anderson, Houston, TX | Lab Research Project Coordinator, The Hospital for Sick Children, Toronto, ON, Canada | UHN Princess Margaret Cancer Centre, Toronto, ON, Canada | St. Michael's Hospital, Toronto, ON, Canada | Ariadne.ai, Heidelberg, Germany | Asst. Professor, Dept. of Surgery, University of Toronto, Toronto, ON, Canada",Visium,Visium,https://www.abstractsonline.com/pp8/#!/21436/presentation/10038
Apr 20,2:00 PM,Afternoon,52,6,10041,3966,17,In situ spatial multiomic profiling of breast cancer tissue utilizing the CosMx Spatial Molecular Imager,Spatial Proteomics and Transcriptomics 2,4/20/2026 2:00:00 PM,"Diagnostic Development, Ontario Institute for Cancer Research, Toronto, ON, Canada | Ontario Institute for Cancer Research, Toronto, ON, Canada",CosMx,CosMx,https://www.abstractsonline.com/pp8/#!/21436/presentation/10041
Apr 20,2:00 PM,Afternoon,52,6,10042,3967,18,Spatial whole transcriptomic profiling of breast cancer tissue with CosMx Spatial Molecular Imager,Spatial Proteomics and Transcriptomics 2,4/20/2026 2:00:00 PM,"Ontario Institute for Cancer Research, Toronto, ON, Canada",CosMx,CosMx,https://www.abstractsonline.com/pp8/#!/21436/presentation/10042
Apr 20,2:00 PM,Afternoon,52,6,10052,3975,26,Spatially resolved multi-omics reveal metastatic ecosystem remodeling and immunomodulatory niches in HGSOC,Spatial Proteomics and Transcriptomics 2,4/20/2026 2:00:00 PM,"Peking-Tsinghua Center for Life Sciences, Academy for Advanced Interdisciplinary Studies, Peking University, Beijing, China | Center for Quantitative Biology, Academy for Advanced Interdisciplinary Studies, Peking University, Beijing, China | Department of Obstetrics and Gynecology, Seventh Medical Center of Chinese PLA General Hospital, Beijing, China",Visium,Visium,https://www.abstractsonline.com/pp8/#!/21436/presentation/10052
Apr 20,2:00 PM,Afternoon,52,6,12036,CT111,3,"Phase 0 intratumoral microdevice study of FX-909 in bladder cancer demonstrates on-target anti-tumor activity and immune modulation, enhanced in combination with anti-PD-1",Phase 0 and First-in-Human Phase I Clinical Trials,4/20/2026 2:00:00 PM,"Flare Therapeutics, Cambridge, MA | Mass General Brigham, Boston, MA | Dana-Farber Cancer Institute, Boston, MA | Kibur Medical, Boston, MA",CosMx,CosMx,https://www.abstractsonline.com/pp8/#!/21436/presentation/12036
Apr 20,2:00 PM,Afternoon,52,6,11650,LB234,9,Cabozantinib remodels the pancreatic tumor microenvironment to potentiate immunotherapy,Late-Breaking Research: Tumor Biology 1,4/20/2026 2:00:00 PM,"University of Arizona College of Medicine, Tucson, AZ | University of Georgia, Athens, GA | Department of Pathology and Laboratory Medicine, University of Cincinnati College of Medicine, Cincinnati, OH | Medical College of Georgia, Augusta University/University of Georgia Medical Partnership, Athens, GA | Department of Surgery, Division of Surgical Oncology, University of Cincinnati, Cincinnati, OH | Hematology and Medical Oncology, University of Cincinnati, Cincinnati, OH | Division of Hematology and Oncology, University of Arizona, College of Medicine, Tucson, AZ",CosMx,CosMx,https://www.abstractsonline.com/pp8/#!/21436/presentation/11650
Apr 20,2:00 PM,Afternoon,52,6,3011,2697,22,Single-cell transcriptomic characterisation reveals pathway determinants of bipolar androgen therapy response in prostate cancer,Application of Bioinformatics to Cancer Biology 3,4/20/2026 2:00:00 PM,"Monash University, Clayton, Victoria, Australia | Peter MacCallum Cancer Centre, Melbourne, Australia | AGRF, Melbourne, Australia | Monash University, Melbourne, Australia | Monash University, Clayton, Australia | Garvan Institute, Sydney, Australia | St Vincents Health Australia, Melbourne, Australia",,10X,https://www.abstractsonline.com/pp8/#!/21436/presentation/3011
Apr 20,2:00 PM,Afternoon,52,6,2653,2757,21,Scale meets Speed: A transcriptome-wide spatial analysis that runs a rapid and interactive hypothesis-driven workflow with AtoMx® SIP,Large Language Models in the Clinic,4/20/2026 2:00:00 PM,"Bruker Spatial Biology, Seattle, WA | Bruker Spatial Biology, Piedmont, CA",,Bruker,https://www.abstractsonline.com/pp8/#!/21436/presentation/2653
Apr 20,2:00 PM,Afternoon,52,6,2613,2784,15,Integrating spatial transcriptomics with MRI reveals distinct radio-spatial genomic profile concordant with prostate cancer clonal heterogeneity,Radiomics and AI in Medical Imaging,4/20/2026 2:00:00 PM,"University of Oxford, Oxford, United Kingdom | Barts Cancer Institute, London, United Kingdom | Oxford University Hospitals, Oxford, United Kingdom",,10X,https://www.abstractsonline.com/pp8/#!/21436/presentation/2613
Apr 20,2:00 PM,Afternoon,52,6,4267,2830,3,Immunomodulatory response in Dato-DXd-treated non-small cell lung cancer patient-derived organotypic tumor spheroids (pDOTS),Immune Mechanisms Invoked by Other Therapies and Exposures,4/20/2026 2:00:00 PM,"Daiichi Sankyo Inc, Baskin Ridge, NJ | Dana-Farber Cancer Institute, Boston, MA | Daiichi Sankyo Co. Ltd., Tokyo, Japan",,10X,https://www.abstractsonline.com/pp8/#!/21436/presentation/4267
Apr 20,2:00 PM,Afternoon,52,6,4912,3104,4,Characterization of high plasticity cell states in cutaneous squamous cell carcinoma in response to chemotherapy and immune checkpoint inhibitor treatments,Overcoming Chemotherapy Resistance,4/20/2026 2:00:00 PM,"Helen Diller Family Comprehensive Cancer Center, University of California, San Francisco, San Francisco, CA | Department of Biochemistry and Biophysics, University of California, San Francisco, San Francisco, CA | Department of Anatomy, University of California, San Francisco, San Francisco, CA",,10X,https://www.abstractsonline.com/pp8/#!/21436/presentation/4912
Apr 20,2:00 PM,Afternoon,52,6,5977,3489,4,EWSR1::WT1 fusion oncoprotein and the androgen receptor shape the biology of desmoplastic small round cell tumors,Pediatric Cancer Genomics and Epigenomics,4/20/2026 2:00:00 PM,"UT MD Anderson Cancer Center, Houston, TX | Tulane University School of Medicine, New Orleans, LA | Howard University, Washington, DC",,10X,https://www.abstractsonline.com/pp8/#!/21436/presentation/5977
Apr 20,2:00 PM,Afternoon,52,6,2546,3544,20,Single-cell multi-omics uncovers coordinated epigenetic and transcriptomic evolution in IDH-mutant glioma,Tumor Evolution,4/20/2026 2:00:00 PM,"Massachusetts General Hospital, Boston, MA | Weill Cornell Medical College, New York, NY | University of Toronto, Toronto, ON, Canada | New York Genome Center, New York, NY | MD Anderson Cancer Center, Houston, TX | Okayama University, Okayama, Japan | University of Tokyo, Tokyo, Japan",,10X,https://www.abstractsonline.com/pp8/#!/21436/presentation/2546
Apr 20,2:00 PM,Afternoon,52,6,9380,3722,24,Preclinical development and evaluation of CD87-directed CART for colorectal cancer,Adoptive Cell Therapy 1,4/20/2026 2:00:00 PM,"Thomas Jefferson University, Philadelphia, PA | Chair, Dept. of Pharm. & Exp. Therapeutics, Thomas Jefferson University, Philadelphia, PA | Sidney Kimmel Cancer Center at Thomas Jefferson University, Philadelphia, PA",,10X,https://www.abstractsonline.com/pp8/#!/21436/presentation/9380
Apr 21,9:00 AM,Morning,61,4,10758,4951,8,Unraveling the role of APOE/APOC1/SPP1/TREM2‑positive lipid‑Associated macrophages in destructive venous invasion and metastasis of colorectal cancer,Spatial Niches and Functional Boundaries within the Tumor Microenvironment 1,4/21/2026 9:00:00 AM,"Seoul National University, Seoul, Korea, Republic of",Xenium; GeoMx,Xenium; Xenium + 5K; GeoMx,https://www.abstractsonline.com/pp8/#!/21436/presentation/10758
Apr 21,9:00 AM,Morning,61,4,10770,4960,17,Cross-platform comparison of spatial transcriptomics technologies in an FFPE lung squamous cell carcinoma sample,Spatial Niches and Functional Boundaries within the Tumor Microenvironment 1,4/21/2026 9:00:00 AM,"Takara Bio USA, San Jose, CA",Xenium; Visium,Xenium; Visium; 10X,https://www.abstractsonline.com/pp8/#!/21436/presentation/10770
Apr 21,9:00 AM,Morning,61,4,10547,4984,9,"Dissociative, spatial, and functional single-cell profiling reveals antigen-driven exhaustion and chemotactic failure of tumor-reactive T cells in HPV-negative HNSCC",Tumor-Immune Crosstalk,4/21/2026 9:00:00 AM,"Medical College of Wisconsin, Milwaukee, WI | Bruker Spatial Biology, Seattle, WA | Bruker Spatial Biology, Piedmont, CA | Bruker Cellular Analysis, Emeryville, CA",CosMx; Beacon,CosMx; Beacon + Bruker; Bruker,https://www.abstractsonline.com/pp8/#!/21436/presentation/10547
Apr 21,9:00 AM,Morning,61,4,10765,4957,14,Spatially resolved profiling of the tumor microenvironment and therapeutic response in SMARCB1-deficient epithelioid sarcoma,Spatial Niches and Functional Boundaries within the Tumor Microenvironment 1,4/21/2026 9:00:00 AM,"Computational Oncology, Memorial Sloan Kettering Cancer Center, New York, NY",Xenium,Xenium; Xenium + 5K; 10X,https://www.abstractsonline.com/pp8/#!/21436/presentation/10765
Apr 21,9:00 AM,Morning,61,4,10775,4965,22,Sarcomatoid transformation rewires the immune spatial landscape and checkpoint regulation in chromophobe renal cell carcinoma,Spatial Niches and Functional Boundaries within the Tumor Microenvironment 1,4/21/2026 9:00:00 AM,"Department of Medicine, Harvard Medical School/Brigham and Women's Hospital, Boston, MA | Tempus AI, Inc., Chigaco, IL | Indiana University School of Medicine, Indianapolis, IN | Department of Pathology, Harvard Medical School / Brigham and Women's Hospital, Boston, MA | Genitourinary Medical Oncology, The University of Texas MD Anderson Cancer Center, Houston, TX",Xenium,Xenium; Xenium + 5K; 10X,https://www.abstractsonline.com/pp8/#!/21436/presentation/10775
Apr 21,9:00 AM,Morning,61,4,10749,4945,2,Distinct colorectal cancer tumor cell subtypes revealed by single-cell and spatial transcriptomics,Spatial Niches and Functional Boundaries within the Tumor Microenvironment 1,4/21/2026 9:00:00 AM,"Sungkyunkwan University, Seoul, Korea, Republic of | University of Ulsan College of Medicine, Seoul | Translational Genomics Center, Seoul, Korea, Republic of | GENINUS, Seoul, Korea, Republic of",Xenium; Visium,Xenium; Visium,https://www.abstractsonline.com/pp8/#!/21436/presentation/10749
Apr 21,9:00 AM,Morning,61,4,1321,4244,12,Investigating the spatial immune tumor microenvironment of dermatofibrosarcoma protuberans,Adaptive Immunity in Cancer,4/21/2026 9:00:00 AM,"Cell, Developmental and Cancer Biology, Oregon Health & Science University, Portland, OR | Cancer Early Detection Advanced Research Center, Oregon Health & Science University, Portland, OR | Department of Dermatology, Oregon Health & Science University, Portland, OR",Visium,Visium; 10X,https://www.abstractsonline.com/pp8/#!/21436/presentation/1321
Apr 21,9:00 AM,Morning,61,4,5504,4403,11,A fast and robust development process providing new highly internalized anti-hHER2 antibody-drug conjugates,Antibody Technologies and Platforms 2,4/21/2026 9:00:00 AM,"Mimabs, Marseille, France",Beacon,Beacon + Bruker; Bruker,https://www.abstractsonline.com/pp8/#!/21436/presentation/5504
Apr 21,9:00 AM,Morning,61,4,1524,4788,6,"PSMA-expressing tumor vasculature in renal cell carcinoma: spatial, functional, and therapeutic implications",Angiogenesis,4/21/2026 9:00:00 AM,"Department of Urology, Ehime University Graduate School of Medicine, Toon, Japan | Department of Biochemistry and Molecular Genetics, Ehime University Graduate School of Medicine, Toon, Japan | Department of Cardiovascular and Thoracic Surgery, Ehime University Graduate School of Medicine, Toon, Japan | Department of Analytical Pathology, Ehime University Graduate School of Medicine, Toon, Japan | Division of Diagnostic Pathology, Ehime University Hospital, Toon, Japan | Department of Oncogenesis and Growth Regulation, Osaka International Cancer Institute, Osaka, Japan",Visium,Visium; 10X,https://www.abstractsonline.com/pp8/#!/21436/presentation/1524
Apr 21,9:00 AM,Morning,61,4,6980,4873,22,Reconstructing drug-tolerant persister (DTP) niches in iPSC-derived alveolar lung cancer organoids for spatio-temporal dissection of cell-cell interactions and ligand-receptor targets,"In Vitro Models 2: 2D, 3D, Organoids, and Spheroids",4/21/2026 9:00:00 AM,"Department of Respirology, Chiba University, Chiba, Japan | HiLung Inc., Kyoto, Japan | Department of Computational Biology and Medical Sciences, Graduate School of Frontier Sciences, The University of Tokyo, Kashiwa, Japan | Exploratory Oncology Research and Clinical Trial Center, National Cancer Center, Kashiwa, Japan",Xenium,Xenium; Xenium + 5K,https://www.abstractsonline.com/pp8/#!/21436/presentation/6980
Apr 21,9:00 AM,Morning,61,4,7526,4903,19,Explore the effects of Fusobacterium nucleatum on chemotherapy response in colorectal cancer at spatial and single-cell resolution,Microbiome-Tumor-Immune Crosstalk,4/21/2026 9:00:00 AM,"University of Minnesota, College of Pharmacy, Minneapolis, MN | Asst. Professor, Dept. of Medicine, University of Minnesota, Minneapolis, MN",Visium,Visium; 10X,https://www.abstractsonline.com/pp8/#!/21436/presentation/7526
Apr 21,9:00 AM,Morning,61,4,10753,4947,4,Spatially organized transcriptional programs and tumor-stroma interfaces shape immunotherapy response in microsatellite instability-high gastrointestinal cancers,Spatial Niches and Functional Boundaries within the Tumor Microenvironment 1,4/21/2026 9:00:00 AM,"UT MD Anderson Cancer Center, Houston, TX | Gastrointestinal Medical Oncology, UT MD Anderson Cancer Center, Houston, TX",Visium,Visium; 10X,https://www.abstractsonline.com/pp8/#!/21436/presentation/10753
Apr 21,9:00 AM,Morning,61,4,10761,4953,10,Spatial tissue architecture as a unifying principle of tumor and microenvironmental states in adult gliomas,Spatial Niches and Functional Boundaries within the Tumor Microenvironment 1,4/21/2026 9:00:00 AM,"AI in Oncology, German Cancer Research Center (DKFZ), Heidelberg, Germany | Department of Neuropathology, Institute of Pathology, Heidelberg University Hospital, Heidelberg, Germany | Department of Hematology, Oncology and Clinical Immunology, Medical Faculty and University Hospital Düsseldorf, Düsseldorf, Germany | Department of Neuropathology, Institute of Pathology, University Hospital Heidelberg, Heidelberg, Germany | Single Cell Open Lab, German Cancer Research Center (DKFZ), Heidelberg, Germany | Division of Experimental Neurosurgery, Department of Neurosurgery, Heidelberg University Hospital, Heidelberg, Germany | Department of Neurosurgery, University Hospital Mannheim, Medical Faculty Mannheim (UMM), University of Heidelberg, Mannheim, Germany | Department of Neurology, University Hospital Heidelberg, Heidelberg, Germany | Department of Neurosurgery, Heidelberg University Hospital, Heidelberg, Germany | Clinical Cooperation Unit Neuroimmunology and Brain Tumor Immunology, German Consortium for Translat, German Cancer Research Center (DKFZ), Heidelberg, Germany",Xenium,Xenium; 10X,https://www.abstractsonline.com/pp8/#!/21436/presentation/10761
Apr 21,9:00 AM,Morning,61,4,10762,4954,11,Integrated scRNAseq andspatial RNAseq analysis of aggressive prostatic adenocarcinoma identifies TIGIT-NECTIN 2/3 and TIGIT/PVRimmunosuppressive interactions,Spatial Niches and Functional Boundaries within the Tumor Microenvironment 1,4/21/2026 9:00:00 AM,"Emory University, Atlanta, GA | Georgia Institute of Technology, Atlanta, GA | Indiana University, Indianapolis, IN",Visium,Visium; 10X,https://www.abstractsonline.com/pp8/#!/21436/presentation/10762
Apr 21,9:00 AM,Morning,61,4,10767,4958,15,Spatial transcriptomic profiling reveals heterogeneity in desmoplastic small round cell tumor,Spatial Niches and Functional Boundaries within the Tumor Microenvironment 1,4/21/2026 9:00:00 AM,"Gerstner Sloan Kettering - Graduate School of Biomedical Sciences, New York, NY | Memorial Sloan Kettering Cancer Center, New York, NY | Herbert Irving Comprehensive Cancer Ctr., New York, NY | Chief, Division of Pediatric Hematology/, Memorial Sloan Kettering Cancer Center, New York, NY",Xenium,Xenium; Xenium + 5K,https://www.abstractsonline.com/pp8/#!/21436/presentation/10767
Apr 21,9:00 AM,Morning,61,4,10772,4962,19,Spatial transcriptomics reveals distinct ASCL1 and ASCL2 gene expression patterns in advanced prostate cancer,Spatial Niches and Functional Boundaries within the Tumor Microenvironment 1,4/21/2026 9:00:00 AM,"Department of Urologic Surgery, University of California Davis, Sacramento, CA | Department of Pathology and Laboratory Medicine, University of California Davis, Sacramento, CA",Visium,Visium; 10X,https://www.abstractsonline.com/pp8/#!/21436/presentation/10772
Apr 21,9:00 AM,Morning,61,4,10549,4986,11,Identification of tumor microenvironment for high infiltration of lymphocytes in triple negative breast cancer,Tumor-Immune Crosstalk,4/21/2026 9:00:00 AM,"Seoul National University, Seoul, Korea, Republic of | Asan Medical Center, Seoul, Korea, Republic of",Xenium,Xenium; Xenium + 5K,https://www.abstractsonline.com/pp8/#!/21436/presentation/10549
Apr 21,9:00 AM,Morning,61,4,10558,4995,20,LAMP3+ migratory dendritic cells establish immune-accessible tumor microenvironment in non-Hodgkin lymphoma,Tumor-Immune Crosstalk,4/21/2026 9:00:00 AM,"Microbial Pathogenesis, Yale School of Medicine, New Haven, CT | Medical Oncology and Hematology, Yale School of Medicine, New Haven, CT",Xenium,Xenium; 10X,https://www.abstractsonline.com/pp8/#!/21436/presentation/10558
Apr 21,9:00 AM,Morning,61,4,9401,5197,15,Metabolically supercharged NK cells engineered with adenoviral E4ORF-1,Adoptive Cell Therapy 2,4/21/2026 9:00:00 AM,"UT MD Anderson Cancer Center, Houston, TX | Molecular and Cellular Oncology, UT MD Anderson Cancer Center, Houston, TX | Professor of Medicine, Dept. of Stem Cell Transplant & Cell Therapy, UT MD Anderson Cancer Center, Houston, TX",Incucyte,Incucyte; Bruker,https://www.abstractsonline.com/pp8/#!/21436/presentation/9401
Apr 21,9:00 AM,Morning,61,4,9341,5265,2,FLASH radiotherapy improves survival in mouse glioblastoma and spares circulating antigen reactive CD8+T-cells,Effects of Ionizing Radiation on Normal Tissues and FLASH Radiation Research,4/21/2026 9:00:00 AM,"Department of Neurosurgery, The University of Texas MD Anderson Cancer Center, Houston, TX | Department of Leukemia, The University of Texas MD Anderson Cancer Center, Houston, TX | Department of Radiation Physics, Division of Radiation Oncology, The University of Texas MD Anderson Cancer Center, Houston, TX",Xenium,Xenium; 10X,https://www.abstractsonline.com/pp8/#!/21436/presentation/9341
Apr 21,9:00 AM,Morning,61,4,11667,LB302,2,Investigation of the immune microenvironment of breast cancer brain metastasis using single-cell spatial genomics,Late-Breaking Research: Tumor Biology 2,4/21/2026 9:00:00 AM,"University of California, Irvine, Irvine, CA",Xenium,Xenium; 10X,https://www.abstractsonline.com/pp8/#!/21436/presentation/11667
Apr 21,9:00 AM,Morning,61,4,11671,LB306,6,Spatial transcriptomics reveals primary-site endothelial EMT reprogramming that drives immunosuppression in metastatic uveal melanoma and predicts poor survival,Late-Breaking Research: Tumor Biology 2,4/21/2026 9:00:00 AM,"George Mason University, Fairfax, VA | University of New Mexico Health Sciences Center, Albuquerque, NM",Visium,Visium; 10X,https://www.abstractsonline.com/pp8/#!/21436/presentation/11671
Apr 21,9:00 AM,Morning,61,4,3021,4124,4,Cancer stem cells and where to find them: Their trajectories and implications in cancer evolution,Application of Bioinformatics to Cancer Biology 4,4/21/2026 9:00:00 AM,"Molecular Genetics, University of Toronto, Toronto, ON, Canada | Molecular Genetics, University of Oxford, Oxford, United Kingdom",Visium,Visium,https://www.abstractsonline.com/pp8/#!/21436/presentation/3021
Apr 21,9:00 AM,Morning,61,4,3026,4129,9,Spatial single-cell transcriptomic profiling reveals distinct immune and stromal landscapes across TIL/PD-L1-defined TNBC subtypes,Application of Bioinformatics to Cancer Biology 4,4/21/2026 9:00:00 AM,"Yonsei University, Seoul, Korea, Republic of | Gangnam Severance Hospital, Seoul, Korea, Republic of",Xenium,Xenium,https://www.abstractsonline.com/pp8/#!/21436/presentation/3026
Apr 21,9:00 AM,Morning,61,4,3044,4146,26,Melanocytic transcriptional state is an independent marker of survival in metastatic melanoma,Application of Bioinformatics to Cancer Biology 4,4/21/2026 9:00:00 AM,"University of Michigan, Ann Arbor, MI | Duke University, Durham, NC | University North Carolina, Chapel Hill, NC",GeoMx,GeoMx,https://www.abstractsonline.com/pp8/#!/21436/presentation/3044
Apr 21,9:00 AM,Morning,61,4,3138,4166,16,Molecular diagnosis of lung tumors with a history of pancreatic cancer: Spatial profiling-based differential markers and functional insights into invasive mucinous adenocarcinoma,Digital Pathology 3,4/21/2026 9:00:00 AM,"Thoracic, Breast and Endocrinological Surgery, Okayama University Graduate School of Medicine, Dentistry and Pharmaceutical Sciences, Okayama, Japan | Center for Comprehensive Genomic Medicine, Okayama University Hospital, Okayama, Japan | Gastroenterological Surgery, Okayama University Graduate School of Medicine, Dentistry and Pharmaceutical Sciences, Okayama, Japan | Pathology and Oncology, Okayama University Graduate School of Medicine, Dentistry and Pharmaceutical Sciences, Okayama, Japan",GeoMx,GeoMx,https://www.abstractsonline.com/pp8/#!/21436/presentation/3138
Apr 21,9:00 AM,Morning,61,4,3173,4175,2,Neoantigen-guided TCR discovery pipeline to improve specificity and reduce off-target toxicity in AML,Integrative Computational Approaches 2,4/21/2026 9:00:00 AM,"Biology and Biochemistry, University of Houston, Houston, TX | UT MD Anderson Cancer Center, Houston, TX",TCR Discovery,TCR Discovery,https://www.abstractsonline.com/pp8/#!/21436/presentation/3173
