keyword,presentation_id,presentation_number,title,session_title,start,authors,affiliation,products,source_keywords,presentation_url
Xenium + 5K,9522,6478,Temporal dynamics of T cell reprogramming associate with clinical response to ICI-based combination therapy in metastatic renal cell carcinoma,Clinical Correlates of Immunotherapy,4/21/2026 2:00:00 PM,"KyuTae Hwang, Seowoo Kim, Mi Zhou, William Y. Kim, Minyong Kang","Department of Health Sciences and Technology, Samsung Advanced Institute of Health Sciences and Technology (SAIHST), Seoul, Korea, Republic of | UNC Lineberger Comprehensive Cancer Center, Chapel Hill, NC | UNC Chapel Hill, Cary, NC | Department of Health Sciences and Technology, Samsung Advanced Institute of Health Sciences and Technology (SAIHST)Samsung Medical Center, Seoul, Korea, Republic of",Xenium,Xenium; Xenium + 5K,https://www.abstractsonline.com/pp8/#!/21436/presentation/9522
Xenium + 5K,10057,6663,Integrated spatial transcriptomic and proteomic profiling reveals tumor-immune niches driving heterogeneity and resistance in clear cell renal cell carcinoma,Spatial Proteomics and Transcriptomics 3,4/21/2026 2:00:00 PM,"Qanber Raza, Nick Zabinyakov, Lauren Tracey, Liang Lim, Christina Loh","Standard BioTools, Markham, ON, Canada",Xenium,Xenium; Xenium + 5K,https://www.abstractsonline.com/pp8/#!/21436/presentation/10057
Xenium + 5K,10446,6741,"Tertiary lymphoid structure (TLS)-associated immune circuits define response to durvalumab, trastuzumab, and pertuzumab (DTP) in HER2-enriched early breast cancer",Immunotherapy: Mechanisms and Responses,4/21/2026 2:50:00 PM,"M. Li, X. Hoi, J. Deng, J. Zheng, R. Hashmani, R. Bayraktar, W. Qian, J. Zhou, J. Guan, K. Sun, H. Mai, T. Sheu, S. Haley, M. Schwartz, S. Mathur, S. T. Wong, F. Nikolo, K. Chan, P. Niravath, J. C. Chang; Houston Methodist Research Institute, Houston, TX, Houston Methodist Hospital, Houston, TX",,Xenium,Xenium; Xenium + 5K,https://www.abstractsonline.com/pp8/#!/21436/presentation/10446
Visium,11223,,"M-Optimus-1: a multimodal foundation model unifying H&E, bulk RNA-seq, scRNA-seq, and visium spatial transcriptomics for cancer research","M-Optimus-1: A Multimodal Foundation Model Unifying H&E, Bulk RNA-seq, scRNA-seq, and Visium Spatial Transcriptomics for Cancer Research",4/21/2026 10:00:00 AM,"Jean-Philippe Vert. Bioptimus, Paris, France",,Visium,Visium,https://www.abstractsonline.com/pp8/#!/21436/presentation/11223
Visium,10770,4960,Cross-platform comparison of spatial transcriptomics technologies in an FFPE lung squamous cell carcinoma sample,Spatial Niches and Functional Boundaries within the Tumor Microenvironment 1,4/21/2026 9:00:00 AM,"Bryan Bell, Cedric Uytingco, Alec Barrett, Bryant Ngo, Jonathan Sakkos, Diksha Kool, Wanxin Wang, Melissa del Rosario, Christina Chang, Christina Fan, Andrew Farmer","Takara Bio USA, San Jose, CA",Xenium; Visium,Xenium; Visium; 10X,https://www.abstractsonline.com/pp8/#!/21436/presentation/10770
Visium,10516,6116,Spatial multi-omics dissection of colorectal cancer micrometastasis,Metastasis and Organ-Specific Microenvironmental Evolution,4/21/2026 2:00:00 PM,"Yang Liu, Akshaya S. Jadhav, Yuwen Pan, Jianlong Liao, Isha Khanduri, Yunhe Liu, Riham Katkhuda, Wei Lu, Kyung Serk Cho, Tieling Zhou, Baohua Sun, Mei Jiang, Sharia D. Hernandez, Idania Carolina Lubo Julio, Patrick Brennan, Guangsheng Pei, Kai Yu, Yibo Dai, Tian Chu, Fuduan Peng, Khaja Khan, Saxon Rodriguez, Ling Xia, Youming Guo, Alicia Mejia, Zhiming Tong, Sean W. Barnes, Ou Shi, Shreeya Indulkar, Alaa Mohamed, Natalie Wall Fowlkes, Timothy Newhook, Yun Shin Chun, Van K. Morris, David G. Menter, Dadi Jiang, Jean-Nicolas Vauthey, Ruoyan Li, Humam Kadara, Luisa M. Solis Soto, Scott Kopetz, Linghua Wang, Dipen M. Maru","The University of Texas MD Anderson Cancer Center, Houston, TX",Visium,Visium,https://www.abstractsonline.com/pp8/#!/21436/presentation/10516
Visium,3286,6914,STCS: Spatial transcriptomics cell segmentation outperforms existing methods on multiple slides,New Algorithms and Computational Methods,4/22/2026 9:00:00 AM,"Xinyu Hu, Fengwei Zhan, Lixia C. Wu, Jose Gonzalez, Chuhanwen Sun, Rachel Ofer, Tyler Tran, Michael Verzi, Jiekun Yang","Department of Genetics, Rutgers University, New Brunswick, NJ | Quantitative Biomedicine Program, Rutgers University, New Brunswick, NJ",Xenium; Visium,Xenium; Visium,https://www.abstractsonline.com/pp8/#!/21436/presentation/3286
Visium,3014,2700,SpaceMarkers 2.0: A framework for spatially aware cell-cell communication in spatial transcriptomic data,Application of Bioinformatics to Cancer Biology 3,4/20/2026 2:00:00 PM,"Orian Stapleton, Dmitrijs Lvovs, Luciane Tsukamoto Kagohara, Elana Judith Fertig, Atul Deshpande","Johns Hopkins University, Baltimore, MD | University of Maryland School of Medicine, Baltimore, MD",Visium,Visium; 10X,https://www.abstractsonline.com/pp8/#!/21436/presentation/3014
Visium,3099,1442,Spatial transcriptomics informed tumor purity estimation from histology slides for triple negative breast cancer,Digital Pathology 2,4/20/2026 9:00:00 AM,"Minh-Khang Le, Vivek Pujara, I-Chuang Liao, Yuan Yuan, Joseph Lownik, Graeme Murray, Jin Sun Bitar, Luxi Chen, Parisa Najafzadeh, Keeyon Dabirian, David Lin, Fred W Kolling IV, Parth S. Shah, Jonathan Marotti, Xiaoying Liu, Louis J. Vaickus, Keluo Yao, Linda T. Vahdat, Zarif L. Azher, Joshua Levy","Cedars-Sinai Medical Center, Los Angeles, CA | Huntington Health, Pasadena, CA | Dartmouth Geisel School of Medicine, Hanover, NH | Dartmouth Hitchcock Medical Center, Lebanon, NH | Zarif Azher (Individual), Great Falls, VA",Visium,Visium,https://www.abstractsonline.com/pp8/#!/21436/presentation/3099
Visium,11264,LB163,Spatial analysis of head and neck cancer reveals two ecosystems with distinct modes of epithelial-to-mesenchymal transition,"Late-Breaking Research: Bioinformatics, Computational Biology, Systems Biology, and Convergent Science 1",4/20/2026 9:00:00 AM,"Dor Simkin, Thomas F. Barrett, Lingling Zhang, Michael J. Moore, Alissa R. Greenwald, Noam G. Darnell, Michael Mints, Salma Ramadan, Victoria Yu, Riley DZ Mullins, Jesse Zaretsky, Porter Bischoff, Douglas Adkins, Wade L. Thorstad, Sana D. Karam, Randall C. Paniello, Jason T. Rich, Ryan S. Jackson, Patrik Pipkorn, Paul A. Zolkind, Guangyong Peng, R. Alex Harbison, Rebecca Chernock, Anuraag S. Parikh, Sidharth V. Puram, Itay Tirosh","Weizmann Institute of Science, Rehovot, Israel | Washington University School of Medicine, St. Louis, MO | Columbia University Irving Medical Center, New York, NY",Visium,Visium; 10X,https://www.abstractsonline.com/pp8/#!/21436/presentation/11264
Visium,11653,LB237,High-resolution spatial transcriptomics identifies unique spatial programs in lung adenocarcinoma from never smokers,Late-Breaking Research: Tumor Biology 1,4/20/2026 2:00:00 PM,"Wei Zhao, Aaron Rozeboom, Phuc H. Hoang, Tam-Anh Tran, Maria Teresa Landi","National Cancer Inst. Div. of Cancer Epidemiology & Genetics, Bethesda, MD | Cancer Genomics Research Laboratory, Leidos Biomedical Research, Frederick National Laboratory for Cancer Research, Frederick, MD",Xenium; Visium,Xenium; Xenium + 5K; Visium; 10X,https://www.abstractsonline.com/pp8/#!/21436/presentation/11653
Visium,3049,5436,Spatial identification of hypoxic and normoxic dormancy hotspots predicting in her2-positive and metastatic breast cancer,Application of Bioinformatics to Cancer Biology 5,4/21/2026 2:00:00 PM,"Tzu-Hung Hsiao, Fan Jhen Liu, Yu-Ting Kang, Kuo Yen Huang, Yidong Chen","Department of Medical Research, Taichung Veterans General Hospital, Taichung City, Taiwan | Graduate School of Advanced Technology, National Taiwan University, Taipei City, Taiwan | Greehey Children's Cancer Research Institute, UT Health San Antonio, San Antonio, TX",Visium,Visium,https://www.abstractsonline.com/pp8/#!/21436/presentation/3049
Visium,3293,6862,A scalable workflow for in silico TMA construction and groupwise comparison of spatial transcriptomic data for analyzing tumor microenvironment,Network Biology and Precision Medicine,4/22/2026 9:00:00 AM,"Dongjoo Lee, Sungwoo Bae, Yeonjae Jung, Kwon Joong Na, Hongyoon Choi","Portrai, Inc., Seoul, Korea, Republic of",Visium,Visium,https://www.abstractsonline.com/pp8/#!/21436/presentation/3293
Visium,9551,7767,Spatial profiling of the tumor immune microenvironment following oncolytic herpes simplex virus treatment in glioblastoma,Immune Response to Therapies,4/22/2026 9:00:00 AM,"Sophia A. Paxton, Corinne H. Strawser, Lakshmi Prakruthi Rao Venkata, Elizabeth A. R. Garfinkle, James M. Markert, Katherine E. Miller, Kevin A. Cassady, Elaine R. Mardis","The Steve and Cindy Rasmussen Institute for Genomic Medicine, The Abigail Wexner Research Institute at Nationwide Children’s Hospital, Columbus, OH | Department of Neurosurgery, University of Alabama at Birmingham, Birmingham, AL | Center for Childhood Cancer Research, The Abigail Wexner Research Institute at Nationwide Children’s Hospital, Columbus, OH",Visium,Visium; 10X,https://www.abstractsonline.com/pp8/#!/21436/presentation/9551
Visium,9746,1037,Single cell and spatially resolved determinants of the clinical outcome of patients (pts) treated with locally advanced/metastatic head and neck squamous cell carcinoma (LA/M SCCHN) treated with immunotherapy (IO),Biomarkers Predictive of Therapeutic Benefit 2,4/19/2026 2:00:00 PM,"Mehdi Lamkhioued, Thimothee Casini, Elodie Girard, Karène Mahtouk, Sonia Canjura-Rodriguez, Valery Attignon, Bastien Cabarrou, Constance Lamy, Anne Schnitzler, Frederique Penault-Llorca, Caroline Even, Christophe Le Tourneau, Ellen Van Obberghen-Schilling, Nicolas Servant, Fayette Jerome, Nathalie Bendriss-Vermare, Ivan Bièche, Pierre Saintigny","Ctr. Léon Bérard, Lyon, France | Inst. Curie, Paris, France | IUCT Oncopole, Toulouse, France | Gustave Roussy, Paris, France | Université côte d'Azur, Nice, France | Genetics Department, Inst. Curie, Paris, France",Visium,Visium,https://www.abstractsonline.com/pp8/#!/21436/presentation/9746
Visium,10012,1210,"Integrated spatial and single-cell profiling uncovers a pre-existing, treatment-resistant subclone that drives early local relapse in luminal breast cancer",Spatial Proteomics and Transcriptomics 1,4/19/2026 2:00:00 PM,"Kazutaka Otsuji, Tomo Osako, Yoko Takahashi, Chikako Shibata, Sumito Saeki, Asumi Iesato, Tetsuo Noda, Kengo Takeuchi, Takayuki Ueno, Reo Maruyama","NEXT-Ganken Program, Japanese Foundation for Cancer Research, Koto-ku, Tokyo, Japan | Division of Pathology, Cancer Institute, Japanese Foundation for Cancer Research, Koto-ku, Tokyo, Japan | Breast Oncology Center, Cancer Institute Hospital of JFCR, Japanese Foundation for Cancer Research, Koto-ku, Tokyo, Japan | Division of Cancer Epigenomics, Cancer Institute, Japanese Foundation for Cancer Research, Koto-ku, Tokyo, Japan | Director's room, Japanese Foundation for Cancer Research, Koto-ku, Tokyo, Japan",Xenium; Visium,Xenium; Visium; 10X,https://www.abstractsonline.com/pp8/#!/21436/presentation/10012
Visium,5939,636,Dissecting the complex ecosystem of intracranial germ cell tumors by spatial RNA and protein analysis,"Developmental Origins, Drivers, and Heterogeneity in Pediatric Cancer",4/19/2026 2:00:00 PM,"Torsten Pietsch, Verena Dreschmann, Pia Zapka, Evelyn Dörner, Christian Vokuhl","Institute of Neuropathology, University of Bonn Medical Center, Bonn, Germany | Department of Pathology, University of Bonn Medical Center, Bonn, Germany",Visium,Visium,https://www.abstractsonline.com/pp8/#!/21436/presentation/5939
Visium,5942,639,Distinct microenvironments define subtypes of neuroblastoma,"Developmental Origins, Drivers, and Heterogeneity in Pediatric Cancer",4/19/2026 2:00:00 PM,"Joseph Seamus Toker, Katherine Elizabeth Masih, Noemi Kedei, Zahin Islam, Ben J. Somerville, Amir Jassim, Michail Mamalakis, Aysen Yuksel, Daniel R. Catchpoole, Li Zhou, Paul Aiyetan, Yong Yean Kim, David Milewski, Shaoli Das, Xinyu Wen, Yong Song, Jun Wei, Richard J. Gilbertson, Javed Khan","University of Cambridge, Cambridge, United Kingdom | National Cancer Institute, Bethesda, MD | Tumour Bank, Children's Cancer Research Unit, The Children's Hospital at Westmead, Westmead, NSW, Australia | Neopathology Corp, Frederick, MD | Pediatrics, Stanford University, Stanford, CA",Visium,Visium,https://www.abstractsonline.com/pp8/#!/21436/presentation/5942
Visium,6245,711,Single-cell and spatial profiling identifies tumor features and actionable surface targets in primary breast angiosarcoma,Molecular Pathology,4/19/2026 2:00:00 PM,"Asumi Iesato, Masashi Akiya, Kazutaka Otsuji, Sumito Saeki, Natsue Uehiro, Tetsuo Noda, Tomo Osako, Takayuki Ueno, Reo Maruyama","Japanese Foundation for Cancer Research, Tokyo, Japan",Visium,Visium,https://www.abstractsonline.com/pp8/#!/21436/presentation/6245
Visium,8420,2253,Multimodal and multikingdom spatial transcriptomics identify bacterial niches implicated in oral cancer development,Tumorigenesis and Early Microenvironmental Trajectories,4/20/2026 9:00:00 AM,"Fushun Chen, Lorena Isabel Gomez, Tieling Zhou, Yuejiang Liu, Inti C. Tarifa Reischle, Sujuan Yang, Manvi Sharma, ,Jiping Feng, Jaafar Hadi, Fuduan Peng, Yibo Dai, Mhenaz Hossain, Ratna Veeramachaneni, Ansam Sinjab, Sean Anderson, Dhrishit Mangrolia, Deborah Rodriguez, Nadim Ajami, Jennifer Wargo, Adel El-Naggar, Roberto Rangel, Nadarajah Vigneswaran, Linghua Wang, Jeffrey N. Myers, Humam Kadara","UT MD Anderson Cancer Center, Houston, TX | UT Health School of Dentistry, Houston, TX",Xenium; Visium,Xenium; Xenium + 5K; Visium,https://www.abstractsonline.com/pp8/#!/21436/presentation/8420
Visium,10034,3957,Spatially derived transcriptomic predictors of immune checkpoint blockade outcome in advance gastric cancer,Spatial Proteomics and Transcriptomics 2,4/20/2026 2:00:00 PM,"Changjin Hong, Sunho Park, Jean R. Clemenceau, Minji Kim, Inyeop Jang, Seock-Jin Chung, Sung Hak Lee, Sam C. Wang, Tae Hyun Hwang","Section Surgical Research, Vanderbilt University Medical Center, Nashville, TN | St. Mary's Hospital Pathology, The Catholic University of Korea, Seoul, Korea, Republic of | Department of Surgery, University of Texas Southwestern Medical Center, Dallas, TX",Visium,Visium; 10X,https://www.abstractsonline.com/pp8/#!/21436/presentation/10034
Visium,10956,4021,Precision diagnostics for early melanoma detection using spatial biology and AI guided image analysis,"Biomarkers That Change Management: Predicting Therapy Benefit, Progression, and Metastatic Risk",4/20/2026 4:05:00 PM,"Y.-C. Kao, S. X. Tan, X. Tan, H. Oey, K. J. Lee, T. Vallius, R. Pelletier, A. Causer, C. Zhou, D. Smit, J. O'Neill, A. Xiong, B. O'Brien, A. Collins, P. K. Sorger, H. Soyer, K. Khosrotehrani, Q. Nguyen, M. S. Stark; Frazer Institute, The University of Queensland, Dermatology Research Centre, Brisbane, Australia, QIMR Berghofer Medical Research Institute, Brisbane, Australia, Harvard Medical School, Brookline, MA, Laboratory of Systems Pharmacology, Harvard Program in Therapeutic Science, Harvard Medical School, Boston, MA, Institute for Molecular Bioscience, the University of Queensland, Brisbane, Australia, QIMR Medical Research Institute, Queensland, Australia, Brisbane, Australia, Sullivan Nicolaides Pathology, Brisbane, Australia, Harvard Medical School, Winchester, MA",,Xenium; Visium,Xenium; Visium,https://www.abstractsonline.com/pp8/#!/21436/presentation/10956
Visium,1321,4244,Investigating the spatial immune tumor microenvironment of dermatofibrosarcoma protuberans,Adaptive Immunity in Cancer,4/21/2026 9:00:00 AM,"Maryam Al-Ghezi, Malia Rettig, Christopher P. Loo, Rashi Yadav, Wesley Yu, Joshua M. Moreau","Cell, Developmental and Cancer Biology, Oregon Health & Science University, Portland, OR | Cancer Early Detection Advanced Research Center, Oregon Health & Science University, Portland, OR | Department of Dermatology, Oregon Health & Science University, Portland, OR",Visium,Visium; 10X,https://www.abstractsonline.com/pp8/#!/21436/presentation/1321
Visium,10755,4949,High resolution spatial transcriptomics reveals dynamic remodeling of the tumor microenvironment during prostate cancer progression,Spatial Niches and Functional Boundaries within the Tumor Microenvironment 1,4/21/2026 9:00:00 AM,"Jiayi Zhou, Gabriel Cruz, Somnath Mahapatra, Radha Paturu, Hanbyul Cho, Xuhong Cao, Fengyun Su, Rui Wang, Dan Robinson, Yi-Mi Wu, Rohit Mehra, Kayla Muschong, Christine Caldwell Smith, Chelsea Decker, Chandan Kumar-Sinha, Saravana Mohan Dhanasekaran, Rahul Mannan, Yuping Zhang, Arul Chinnaiyan","University of Michigan, Ann Arbor, MI",Visium,Visium,https://www.abstractsonline.com/pp8/#!/21436/presentation/10755
Visium,10762,4954,Integrated scRNAseq andspatial RNAseq analysis of aggressive prostatic adenocarcinoma identifies TIGIT-NECTIN 2/3 and TIGIT/PVRimmunosuppressive interactions,Spatial Niches and Functional Boundaries within the Tumor Microenvironment 1,4/21/2026 9:00:00 AM,"Jerry A. Ombor, Anurendra Kumar, Jatin Gandhi, Rakesh Shiradkar, Tilak Pathak, Cynthia L. Winham, Ismaheel O. Lawal, Olayinka A. Abiodun-Ojo, Lara Harik, Saurabh Sinha, Martin G. Sanda, David M. Schuster, Adeboye O. Osunkoya, Carlos S. Moreno","Emory University, Atlanta, GA | Georgia Institute of Technology, Atlanta, GA | Indiana University, Indianapolis, IN",Visium,Visium; 10X,https://www.abstractsonline.com/pp8/#!/21436/presentation/10762
Visium,3062,5450,Decoding ADC payload dynamics with a spatial transcriptomics-integrated tumor microenvironment PK model,Application of Bioinformatics to Cancer Biology 5,4/21/2026 2:00:00 PM,"Sungwoo Bae, Jeongbin Park, Jin Yeong Choi, Daeseung Lee, Hyung-Jun Im, Hongyoon Choi","Portrai, Inc., Seoul, Korea, Republic of",Visium,Visium,https://www.abstractsonline.com/pp8/#!/21436/presentation/3062
Visium,3239,5505,A unified framework for cross-platform spatial omics analysis and deep spatial profiling,New Software Tools for Data Analysis,4/21/2026 2:00:00 PM,"Yunhe Liu, Edoardo L. Draetta, Kayla R. Caughlin, Alexandria Lau, Andre Fonseca, Tian Chu, Kyung Serk Cho, Yibo Dai, Yang Liu, Jun Wang, Jiahui Jiang, Yinyin Yuan, Futreal Andrew, Mingyao Li, Linghua Wang","Department of Genomic Medicine, The University of Texas MD Anderson Cancer Center, Houston, TX | Department of Translational Molecular Pathology,, The University of Texas MD Anderson Cancer Center, Houston, TX | Instituto Metropole Digital (IMD), Universidade Federal do Rio Grande do Norte (UFRN), Natal, Brazil | The University of Texas MD Anderson Cancer Center, Houston, TX | University of Pennsylvania, Philadelphia, PA",Visium,Visium,https://www.abstractsonline.com/pp8/#!/21436/presentation/3239
Visium,3248,5514,BART-spatial: Predicting biologically significant transcriptional regulators from spatial omics data,New Software Tools for Data Analysis,4/21/2026 2:00:00 PM,"Jingyi Wang, Hongpan Zhang, Zhenjia Wang, Chongzhi Zang","Department of Genome Sciences, University of Virginia, Charlottesville, VA | Department of Genome Sciences, University of Virginia, CHARLOTTESVILLE, VA",Visium,Visium; 10X,https://www.abstractsonline.com/pp8/#!/21436/presentation/3248
Visium,3258,5524,Visualization and analysis of cancer genomics data using UCSC Xena,New Software Tools for Data Analysis,4/21/2026 2:00:00 PM,"Mary Goldman, Brian Craft, Cally Lin, Jingchun Zhu, David Haussler","UC Santa Cruz Genomics Institute, Santa Cruz, CA | Stanford University, San Francisco, CA | Investigator/Distinguished Professor, Ctr. For Bio. Sci. & Eng., UC Santa Cruz, Santa Cruz, CA",Xenium; Visium; Chromium; CosMx; MerFISH,Xenium; Visium; Chromium; 10X; CosMx; MerFISH,https://www.abstractsonline.com/pp8/#!/21436/presentation/3258
Visium,7093,6077,A natural antibody response associated with improved survival of SCLC patients can be actively induced in a SCLC mouse model and leads to significantly improved survival,"In Vivo Models 2: Genetically Engineered Mouse Models, PDXs, Syngeneic Models",4/21/2026 2:00:00 PM,"Diego Alejandro Velarde, Joseph Valdes, Chunli Yan, Sarah Elmalh, Hannah Lee, Daniel James Mullen, Angie Moreno, Matthew A. Gladstone, JONATHAN CASTILLO, Crystal N. Marconett, Nicky Nie, Ming Li, W. Martin Kast, Ite A. Offringa","USC/Norris Comprehensive Cancer Center, Los Angeles, CA | University of California San Diego, San Diego, CA | USC - University of Southern California, Los Angeles, CA | University of Southern California, Los Angeles, CA | City of Hope Beckman Research Institute, Duarte, CA | Beckman Research Institute of The City of Hope, Glendale, CA | Keck School of Medicine of USC, Los Angeles, CA",Visium,Visium,https://www.abstractsonline.com/pp8/#!/21436/presentation/7093
Visium,8061,6187,Elevating bulk sequencing with high-resolution spatial transcriptomics: A paired-data analysis of clinically-relevant spatial niches in CRC and NSCLC,Spatial Niches and Functional Boundaries within the Tumor Microenvironment 2,4/21/2026 2:00:00 PM,"Yajas Shah, Tianyou Luo, Christine M. Hoeman, Luca Lonini, Stanislaw Szydlo, Eduardo Diaz, Rossin Erbe, Matthew B. Maxwell, Michelle M. Stein, Andrew J. Sedgewick, Nicholas Rachell, Zachary Chelsky, Sonal Khare, Ryan D. Jones, Kate Sasser, Richard A. Klinghoffer, Justin Guinney, Chi-Sing Ho","Tempus AI, Chicago, IL",Visium,Visium; 10X,https://www.abstractsonline.com/pp8/#!/21436/presentation/8061
Visium,8062,6188,Decoding the archetypes and ecotypes of triple-negative breast cancer in responses to chemotherapy,Spatial Niches and Functional Boundaries within the Tumor Microenvironment 2,4/21/2026 2:00:00 PM,"Yun Yan, Yiyun Lin, Tapsi Kumar, Shanshan Bai, Aatish Thennavan, Jianzhuo Li, Tuan Tran, Min Hu, Mitchell Rao, Anna Casasent, Elizabeth Ravenberg, Gaiane Margishvili Rauch, Alyson Clayborn, Debu Tripathy, Alastair Thompson, Bora Lim, Lei Huo, Lei Huo, Stacy Moulder, Clinton Yam, Nicholas E. Navin","UT MD Anderson Cancer Center, Houston, TX | Baylor College of Medicine, Dan L. Duncan Cancer Center, Houston, TX",Xenium; Visium,Xenium; Visium,https://www.abstractsonline.com/pp8/#!/21436/presentation/8062
Visium,3400,12,Integrative spatial multi-omics profiling enhanced by artificial intelligence reveals ancestry-associated molecular features in early-onset colorectal cancer among Southern California patients,AACR Project GENIE: Predictive Models and AI,4/19/2026 2:00:00 PM,"Francisco G. Carranza, Brigette Waldrup, Yuxin Jin, Yonatan Amzaleg, David Craig, John Carpten, PE-CGS Network, Enrique I. Velazquez Villarreal","Department of Integrative Translational Sciences, City of Hope National Medical Center, Duarte, CA",Visium,Visium; 10X,https://www.abstractsonline.com/pp8/#!/21436/presentation/3400
Visium,10001,1201,Spatial 3D and multi-omics mapping of diffuse gastric cancer evolution from preinvasive to invasive lesions in CDH1 mutation carriers,Spatial Proteomics and Transcriptomics 1,4/19/2026 2:00:00 PM,"Yunhe Liu, Idania Carolina Lubo Julio, Wei Lu, Alejandra G. Serrano, Jean R. Clemenceau, Amber Famiglietti, Karen Colbert, Yibo Dai, Yang Liu, Jun Wang, Jeremy L. Davis, Mingyao Li, Paul F. Mansfield, Tae Hyun Hwang, Luisa M. Solis-Soto, Linghua Wang","Department of Genomic Medicine, The University of Texas MD Anderson Cancer Center, Houston, TX | Department of Translational and Molecular Pathology, The University of Texas MD Anderson Cancer Center, Houston, TX | Department of Surgery, Vanderbilt University Medical Center, Nashville, TN | National Institute of Dental and Craniofacial Research, National Institutes of Health, Bethesda, MD | Department of Clinical Cancer Prevention, The University of Texas MD Anderson Cancer Center, Houston, TX | BioChemistry&Molecular Biology, University of Maryland School of Medicine, Baltimore, MD | University of Pennsylvania, Philadelphia, PA | Vice President, Acute Care Services, UT MD Anderson Cancer Ctr., Houston, TX | Department of Translational Molecular Pathology, the university of MD Anderson cancer center, Houston, TX",Xenium; Visium; CosMx; GeoMx; G4X,Xenium; Xenium + 5K; Visium; CosMx; GeoMx; G4X,https://www.abstractsonline.com/pp8/#!/21436/presentation/10001
Visium,10006,1205,Trajectory-aware spatial transcriptomics deconvolution via image representation of RNA-seq data,Spatial Proteomics and Transcriptomics 1,4/19/2026 2:00:00 PM,"Junyan Liu, Md Tauhidul Islam, Lei Xing","Stanford University, Palo Alto, CA",Xenium; Visium,Xenium; Visium,https://www.abstractsonline.com/pp8/#!/21436/presentation/10006
Visium,10009,1207,Multimodal profiling of STIC lesions identifies precursor states with genomic features of high grade serous ovarian cancer,Spatial Proteomics and Transcriptomics 1,4/19/2026 2:00:00 PM,"Duaa Hassan Al-Rawi, Nataly Naser Al Deen, Cristina Sotomayor-Vivas, Kerstin Thol, Herman Chui, Aveline Filliol, Areej Alsaafin, Hunter Green, Danguole Norkunaite, Mercedes Duran, Nicholas Ceglia, Kara Long-Roche, Britta Weigelt, Andrew McPherson, Scott W. Lowe, Sohrab Shah","Memorial Sloan Kettering Cancer Center, New York, NY | Assistant Member (Level 1), Dept. of Pathology, Memorial Sloan Kettering Cancer Center, New York, NY",Visium,Visium,https://www.abstractsonline.com/pp8/#!/21436/presentation/10009
Visium,10011,1209,FGFR2 translocated sinonasal adenocarcinoma: A biphasic seromucinous adenocarcinoma with a distinctive and targetable molecular phenotype,Spatial Proteomics and Transcriptomics 1,4/19/2026 2:00:00 PM,"Diana Bell, Randal S. Weber, Miao Zhang, Michelle Afkhami, Raja R. Seethala","University of Pittsburgh, Pittsburgh, PA | University of Texas MD Anderson Cancer Center, Houston, TX | City of Hope, Duarte, CA",Visium,Visium; 10X,https://www.abstractsonline.com/pp8/#!/21436/presentation/10011
