keyword,presentation_id,presentation_number,title,session_title,start,authors,affiliation,products,source_keywords,presentation_url
10X,705,2207,The impact of tumor treating fields (TTFields) on the transcriptome and the secretome of cancer stem-like cells isolated from the sub-ventricular zone of glioblastoma patients,Metabolic and Transcriptional Control of Cancer Stem Cell Plasticity,4/20/2026 9:00:00 AM,"Rachel B. Sidebottom, Antonia E. Sajche Sapon, Yamhilette Licon-Munoz, Christian A. Bowers, Sara G.m. Piccirillo","Cell Biology and Physiology, University of New Mexico Health Sciences Center, Albuquerque, NM | Neurosurgery, University of New Mexico Health Sciences Center, Albuquerque, NM",,10X; Bruker,https://www.abstractsonline.com/pp8/#!/21436/presentation/705
10X,10567,2221,Tumor-associated CD207+ cDC2 drives TLS formation via TNF family cytokines in non-small cell lung cancer,Tertiary Lymphoid Structures in Cancer,4/20/2026 9:00:00 AM,"Youngtaek Kim, Gang-Taik Lee, Dong Kwon Kim, JuHyeon Lee, So Young Park, Jae Hwan Kim, Hyun Jung Yoo, Byoung Chul Cho","Yonsei University College of Medicine, Seoul, Korea, Republic of | Department of Research Support, Yonsei Biomedical Research Institute, Seoul, Korea, Republic of | Yonsei New Il Han Institute for Integrative Lung Cancer Research, Seoul, Korea, Republic of",Chromium,Chromium; 10X,https://www.abstractsonline.com/pp8/#!/21436/presentation/10567
10X,8222,2264,Spatial trajectories and niche rewiring from ground‑glass to solid transition in lung adenocarcinoma,Tumorigenesis and Early Microenvironmental Trajectories,4/20/2026 9:00:00 AM,"Kwon Joong Na, Hongyoon Choi, Jaemoon Koh, Taeyoung Yun, Jihyeon Park, Bubse Na, Samina Park, In Kyu Park, Chang Hyun Kang, Young Tae Kim","Seoul National University Hospital, Seoul, Korea, Republic of",Visium,Visium; 10X,https://www.abstractsonline.com/pp8/#!/21436/presentation/8222
10X,11345,LB122,"Dynamic interactions of spatially organized tumor, stromal and immune cellular niches predict outcome to immune checkpoint blockade (ICB) in recurrent or metastatic head and neck squamous cell carcinoma (RM-HNSCC)",Late-Breaking Research: Clinical Research 2,4/20/2026 9:00:00 AM,"Grégoire Marret, Jinsu An, Farnoosh Abbas Aghababazadeh, Kewei Ni, Lucas Penny, Martin Hyrcza, Ben X. Wang, Enrique Sanz-Garcia, Anna Spreafico, Giselle Boukhaled, Simone Stone, Aaron R. Hansen, Troy Ketela, Benjamin Haibe-Kains, Scott V. Bratman, Pinaki Bose, Lillian L. Siu","Division of Medical Oncology and Hematology, Princess Margaret Cancer Centre, University Health Network, University of Toronto, Toronto, ON, Canada | Department of Biochemistry and Molecular Biology, Cumming School of Medicine, University of Calgary, Calgary, AB, Canada | Princess Margaret Cancer Centre, University Health Network, University of Toronto, Toronto, ON, Canada | Department of Pathology and Laboratory Medicine, Cumming School of Medicine, University of Calgary, Calgary, AB, Canada | Department of Oncology, Cumming School of Medicine, University of Calgary, Calgary, AB, Canada",Visium,Visium; 10X,https://www.abstractsonline.com/pp8/#!/21436/presentation/11345
10X,11346,LB123,Spatial immune architecture at single-cell resolution predicts response to atezolizumab plus bevacizumab in advanced HCC,Late-Breaking Research: Clinical Research 2,4/20/2026 9:00:00 AM,"Anna Vila-Escoda, Marta Piqué-Gili, Marta Casado-Pelaez, Roser Pinyol, Ana Hernández de Sande, Verónica Davalos, Albert Gris-Oliver, Carla Montironi, Judit Peix, Daniela Grases, Ezequiel Mauro, Guillem Cano-Segarra, Sarah Cappuyns, Igor Figueiredo, Giorgio Ioannou, Edgar Gonzalez-Kozlova, Tim Meyer, Anja Lachenmayer, Jens U Marquardt, Helen L Reeves, Julien Edeline, Fabian Finkelmeier, Jörg Trojan, Sacha Gnjatic, Jean-Frederic Blanc, Richard A Hubner, Matthias Pinter, Tom Luedde, Arndt Vogel, Daniela Sia, Vincenzo Mazzaferro, Manel Esteller, Jeroen Dekervel, Eduard Porta-Pardo, Josep M Llovet","Liver Cancer Translational Research Group, Institut d’Investigacions Biomèdiques August Pi i Sunyer, Hospital Clínic, Barcelona. Mount Sinai Liver Cancer Program, Divisions of Liver Diseases, Tisch Cancer Institute, Icahn School of Medicine at Mount Sinai, New York, NY | Cancer Epigenetics Group, Josep Carreras Leukaemia Research Institute (IJC), IJC Building, Germans Trias I Pujol, Barcelona, Spain | Liver Cancer Translational Research Group, Institut d’Investigacions Biomèdiques August Pi i Sunyer, Hospital Clínic, Barcelona, Spain | Liver Cancer Translational Research Group, Institut d’Investigacions Biomèdiques August Pi i Sunyer, Hospital Clínic; Pathology Department and Molecular Biology Core, Hospital Clínic of Barcelona, Barcelona, Spain | Josep Carreras Leukemia Research Institute (IJC), Barcelona, Spain | Liver Cancer Translational Research Group, Institut d’Investigacions Biomèdiques August Pi i Sunyer, Hospital Clínic, Barcelona; Centro de Investigación Biomédica en Red de Enfermedades Hepáticas y Digestivas, Madrid, Barcelona, Spain | Digestive Oncology, Department of Gastroenterology, University Hospitals Leuven, Leuven, Belgium | Department of Immunology and Immunotherapy, Icahn School of Medicine at Mount Sinai, New York, NY | Research Department of Oncology, UCL Cancer Institute, University College London, Royal Free Hospital, London, United Kingdom | Department of Visceral Surgery and Medicine, Inselspital, Bern University Hospital, University of Bern, Bern, Switzerland | Department of Medicine I, University Medical Center Schleswig Holstein Campus Lübeck, Lübeck, Germany | Newcastle University Translational Research Institute, Newcastle upon Tyne NHS Foundation Trust, and NIHR Newcastle Biomedical Research Centre, Newcastle, United Kingdom | Department of Medical Oncology, Centre Eugène Marquis, Rennes, France | Department of Gastroenterology, University Liver and Cancer Centre, Frankfurt, Germany | Department of Hepatogastroenterology and Medical Oncology, CHU de Bordeaux Hôpital Haut-Lévêque, Pessac, France | Department of Medical Oncology, The Christie NHS Foundation Trust, Wilmslow Road, Manchester, United Kingdom | Division of Gastroenterology and Hepatology, Department of Medicine, Medical University of Vienna, Vienna, Austria | Department of Gastroenterology, Hepatology and Infectious Diseases, University Hospital Dusseldorf, Medical Faculty at Heinrich Heine University Dusseldorf, Dusseldorf, Germany | Hannover Medical School, Hannover, Austria | Mount Sinai Liver Cancer Program, Divisions of Liver Diseases, Department of Medicine, Tisch Cancer Institute, Icahn School of Medicine at Mount Sinai, New York, NY | Department of Oncology and Hemato-Oncology, University of Milan, Milan, Italy; HPB Surgery, Hepatology and Liver Transplantation, Fondazione IRCCS Istituto Nazionale Tumori di Milano, Milan, Italy | Josep Carreras Leukemia Research Institute (IJC).Centro de Investigacion Biomedica en Red Cancer. Institucio Catalana de Recerca i Estudis Avançats (ICREA), Barcelona, Spain | Department of Gastroenterology and Hepatology, University Hospitals KU Leuven, Leuven, Belgium | Josep Carreras Leukemia Research Institute (IJC). Barcelona Supercomputing Center (BSC), Barcelona, Spain",Xenium,Xenium; 10X,https://www.abstractsonline.com/pp8/#!/21436/presentation/11346
10X,11264,LB163,Spatial analysis of head and neck cancer reveals two ecosystems with distinct modes of epithelial-to-mesenchymal transition,"Late-Breaking Research: Bioinformatics, Computational Biology, Systems Biology, and Convergent Science 1",4/20/2026 9:00:00 AM,"Dor Simkin, Thomas F. Barrett, Lingling Zhang, Michael J. Moore, Alissa R. Greenwald, Noam G. Darnell, Michael Mints, Salma Ramadan, Victoria Yu, Riley DZ Mullins, Jesse Zaretsky, Porter Bischoff, Douglas Adkins, Wade L. Thorstad, Sana D. Karam, Randall C. Paniello, Jason T. Rich, Ryan S. Jackson, Patrik Pipkorn, Paul A. Zolkind, Guangyong Peng, R. Alex Harbison, Rebecca Chernock, Anuraag S. Parikh, Sidharth V. Puram, Itay Tirosh","Weizmann Institute of Science, Rehovot, Israel | Washington University School of Medicine, St. Louis, MO | Columbia University Irving Medical Center, New York, NY",Visium,Visium; 10X,https://www.abstractsonline.com/pp8/#!/21436/presentation/11264
10X,3011,2697,Single-cell transcriptomic characterisation reveals pathway determinants of bipolar androgen therapy response in prostate cancer,Application of Bioinformatics to Cancer Biology 3,4/20/2026 2:00:00 PM,"Rosalia Quezada Urban, Shivakumar Keerthikumar, Peter Lau, Georgia Cuffe, Linda Teng, Ashlee K. Clark, Gail P. Risbridger, Renea A. Taylor, Megan Crumbaker, ANTHONY JOSHUA, Mitchell G. Lawrence","Monash University, Clayton, Victoria, Australia | Peter MacCallum Cancer Centre, Melbourne, Australia | AGRF, Melbourne, Australia | Monash University, Melbourne, Australia | Monash University, Clayton, Australia | Garvan Institute, Sydney, Australia | St Vincents Health Australia, Melbourne, Australia",,10X,https://www.abstractsonline.com/pp8/#!/21436/presentation/3011
10X,3014,2700,SpaceMarkers 2.0: A framework for spatially aware cell-cell communication in spatial transcriptomic data,Application of Bioinformatics to Cancer Biology 3,4/20/2026 2:00:00 PM,"Orian Stapleton, Dmitrijs Lvovs, Luciane Tsukamoto Kagohara, Elana Judith Fertig, Atul Deshpande","Johns Hopkins University, Baltimore, MD | University of Maryland School of Medicine, Baltimore, MD",Visium,Visium; 10X,https://www.abstractsonline.com/pp8/#!/21436/presentation/3014
10X,3338,2708,Revealing fibroblast-mediated impacts to therapy response through spatially resolved drug response prediction in lung cancer,Integration of Clinical and Research Data,4/20/2026 2:00:00 PM,"Robert F. Gruener, Weijie Zhang, Lilin Wang, Adam M. Lee, R. Stephanie Huang","University of Minnesota, College of Pharmacy, Minneapolis, MN | University of Minnesota, Minneapolis, MN | Asst. Professor, Dept. of Medicine, University of Minnesota, Minneapolis, MN",Xenium; CosMx,Xenium; 10X; CosMx,https://www.abstractsonline.com/pp8/#!/21436/presentation/3338
10X,2613,2784,Integrating spatial transcriptomics with MRI reveals distinct radio-spatial genomic profile concordant with prostate cancer clonal heterogeneity,Radiomics and AI in Medical Imaging,4/20/2026 2:00:00 PM,"Thineskrishna Anbarasan, Sandy Figiel, Max Beesley, Wencheng Yin, Ruth McPherson, Richard Colling, Freddie Hamdy, Richard J. Bryant, Bartlomiej Papiez, Alastair D. Lamb, Ian Mills","University of Oxford, Oxford, United Kingdom | Barts Cancer Institute, London, United Kingdom | Oxford University Hospitals, Oxford, United Kingdom",,10X,https://www.abstractsonline.com/pp8/#!/21436/presentation/2613
10X,5309,2823,Single-cell RNA-seq reveals insights into the effects of immune checkpoint inhibitors,Immune Checkpoints,4/20/2026 2:00:00 PM,"Junting Lu, Jinghui Xiu, Ce Zhong, Wentao Li, Wei Yun, Tan Pang, Jingqi Huang","Pharmacology, Pharmaron, Beijing, China",Chromium,Chromium; 10X,https://www.abstractsonline.com/pp8/#!/21436/presentation/5309
10X,4267,2830,Immunomodulatory response in Dato-DXd-treated non-small cell lung cancer patient-derived organotypic tumor spheroids (pDOTS),Immune Mechanisms Invoked by Other Therapies and Exposures,4/20/2026 2:00:00 PM,"Satoru Yasuda, Patrick Hall Lizotte, Elena Ivanova, Zhaorong Li, Yui Tanaka, Daisuke Okajima, Minh Ha, David A. Barbie, Cloud P. Paweletz","Daiichi Sankyo Inc, Baskin Ridge, NJ | Dana-Farber Cancer Institute, Boston, MA | Daiichi Sankyo Co. Ltd., Tokyo, Japan",,10X,https://www.abstractsonline.com/pp8/#!/21436/presentation/4267
10X,4912,3104,Characterization of high plasticity cell states in cutaneous squamous cell carcinoma in response to chemotherapy and immune checkpoint inhibitor treatments,Overcoming Chemotherapy Resistance,4/20/2026 2:00:00 PM,"Ramin Farhad, Di Wu, Mark A. Taylor, Allan Balmain, Rosemary J. Akhurst","Helen Diller Family Comprehensive Cancer Center, University of California, San Francisco, San Francisco, CA | Department of Biochemistry and Biophysics, University of California, San Francisco, San Francisco, CA | Department of Anatomy, University of California, San Francisco, San Francisco, CA",,10X,https://www.abstractsonline.com/pp8/#!/21436/presentation/4912
10X,3498,3326,C-myc driven by differentiation factors in early-onset colorectal cancer (EOCRC),Tumorigenesis Drivers,4/20/2026 2:00:00 PM,"Kazuaki Okamoto, Yalda Naeini, Anton Bilchik, Dave Hoon","Department of Translational Molecular Medicine, St. John’s Cancer Institute (SJCI), Providence St. John's Health Center (PSJHC), Santa Monica, CA | Department of Surgical Pathology, PSJHC, Santa Monica, CA | Department of Gastrointestinal and Hepatobiliary Surgery, PSJHC, Santa Monica, CA",Xenium,Xenium; 10X,https://www.abstractsonline.com/pp8/#!/21436/presentation/3498
10X,8142,3435,Spatial transcriptomic profiling reveals distinct tumor microenvironment remodeling patterns associated with immune checkpoint blockade response in lung adenocarcinoma,Microenvironmental Determinants of Therapy Response and Resistance 1,4/20/2026 2:00:00 PM,"Heesoo Yoon, Jin-Wook Choi, Sejoon Lee, Jin-Haeng Chung, Hyojin Kim","Department of Pathology, Seoul National University Bundang Hospital, Seongnam-si, Korea, Republic of | Precision Medicine Center, Seoul National University Bundang Hospital, Seongnam-si, Korea, Republic of",Visium,Visium; 10X,https://www.abstractsonline.com/pp8/#!/21436/presentation/8142
10X,5977,3489,EWSR1::WT1 fusion oncoprotein and the androgen receptor shape the biology of desmoplastic small round cell tumors,Pediatric Cancer Genomics and Epigenomics,4/20/2026 2:00:00 PM,"Danh Truong, Emre Arslan, Veena Kochat, Jiaqian Fan, Diana Shamsutdinova, Davis Ingram, Kevin Murgas, Clement Agyemang, Roberto Cardenas-Zuniga, Asmaa G. Ahmed, Justin Magrath, Alexander Lazar, Najat Daw Bitar, Sean B. Lee, Andrea Hayes-Dixon, Kunal Rai, Joseph A. Ludwig","UT MD Anderson Cancer Center, Houston, TX | Tulane University School of Medicine, New Orleans, LA | Howard University, Washington, DC",,10X,https://www.abstractsonline.com/pp8/#!/21436/presentation/5977
10X,945,3617,Immunogenomic alterations driving premalignant lesions to invasive lesions of the head and neck,Metabolism and Microbiome in Cancer Initiation and Prevention,4/20/2026 2:00:00 PM,"Foram Ujjvalkumar Vaidya, Alvaro Gutierrez, Abberly Lott Limbach, Bhavna Kumar, Martin P. Alphonse, James W. Rocco, Mariana Brait, Amanda Ewart Toland, David Sidransky","The Sidney Kimmel Comprehensive Cancer Center, Johns Hopkins University School of Medicine, Baltimore, MD | Centro de Excelencia en Medicina Traslacional, Universidad de La Frontera, Temuco, Chile | Department of Pathology, College of Medicine, The Ohio State University Wexner Medical Center, Columbus, OH | Department of Otolaryngology-Head and Neck Surgery, OSU Comprehensive Cancer Center, The Ohio State University, Columbus, OH | Department of Dermatology, Johns Hopkins University School of Medicine, Baltimore, MD | Department of Cancer Biology and Genetics, OSU Comprehensive Cancer Center, The Ohio State University, Columbus, OH",Visium,Visium; 10X,https://www.abstractsonline.com/pp8/#!/21436/presentation/945
10X,10032,3955,Spatial characterization of tumor-immune interactions in MMR-p and MMR-d among African American colorectal cancer patients using attention-based modeling,Spatial Proteomics and Transcriptomics 2,4/20/2026 2:00:00 PM,"Hassan Brim, Khushi Desai, Shweta Dixi, Justin Hong, Colles Price, Jonathan H. Chen, Nicolas Fernandez, Sara Sim, Sami Farhi, Rabia Zafar, Elham Azizi, Hassan Ashktorab","Howard University, Dist. of Columbia, DC | Columbia, New York, NY | Takeda Pharmaceutical Company Ltd., Deerfield, IN | Northwestern University, Chicago, IL | Broad, New York, NY",Xenium,Xenium; Xenium + 5K; 10X,https://www.abstractsonline.com/pp8/#!/21436/presentation/10032
10X,11441,LB191,Decoding metastasis and therapy resistance in sarcomatoid bladder cancer,Late-Breaking Research: Experimental and Molecular Therapeutics 2,4/20/2026 2:00:00 PM,"Jiaqian Luo, Sizhi P. Gao, Jacob E. Tallman, Fengshen Kuo, Merve Basar, Cansu Yol, Syed M. Alam, Hui Jiang, Xinran Tang, Alejandra Lopez Rojas, Ecenur Turkay, Jonathan E. Rosenberg, Iyer Gopakumar, Eugene J. Pietzak, David B. Solit, Hikmat Al-Ahmadie","Memorial Sloan Kettering Cancer Center, New York, NY",Visium,Visium; 10X,https://www.abstractsonline.com/pp8/#!/21436/presentation/11441
10X,11653,LB237,High-resolution spatial transcriptomics identifies unique spatial programs in lung adenocarcinoma from never smokers,Late-Breaking Research: Tumor Biology 1,4/20/2026 2:00:00 PM,"Wei Zhao, Aaron Rozeboom, Phuc H. Hoang, Tam-Anh Tran, Maria Teresa Landi","National Cancer Inst. Div. of Cancer Epidemiology & Genetics, Bethesda, MD | Cancer Genomics Research Laboratory, Leidos Biomedical Research, Frederick National Laboratory for Cancer Research, Frederick, MD",Xenium; Visium,Xenium; Xenium + 5K; Visium; 10X,https://www.abstractsonline.com/pp8/#!/21436/presentation/11653
10X,11654,LB238,Spatial transcriptomics identifies distinct molecular and immune pathways in endometrial cancer in African American women,Late-Breaking Research: Tumor Biology 1,4/20/2026 2:00:00 PM,"Danyelle Hill, Yuxin Jin, Javier Arias-Stella, Joseph Carlson, David Craig, Rania Bassiouni, John Carpten","Beckman Research Institute of The City of Hope, Duarte, CA | The City of Hope, Duarte, CA",Visium,Visium; 10X,https://www.abstractsonline.com/pp8/#!/21436/presentation/11654
10X,4578,4036,Deciphering regulatory drivers of lineage plasticity and resistance to antibody-drug conjugates in urothelial bladder cancer,"Cracking Adaptive Resistance: AI-Enabled, Screen-Guided Targets in Tumor Plasticity, DNA Damage, Metabolism, and CTC-Associated Immunity",4/20/2026 3:20:00 PM,"Jiaqian Luo, Sizhi P. Gao, Jacob E. Tallman, Fengshen Kuo, Merve Basar, Cansu Yol, Syed M. Alam, Hui Jiang, Xinran Tang, Doris X. T. Zheng, Jordan E. Eichholz, Alejandra Lopez Rojas, Ecenur Turkay, Jonathan E. Rosenberg, Gopakumar Iyer, Eugene J. Pietzak, David B. Solit, Hikmat Al-Ahmadie","Memorial Sloan Kettering Cancer Center, New York, NY",Visium,Visium; 10X,https://www.abstractsonline.com/pp8/#!/21436/presentation/4578
10X,1321,4244,Investigating the spatial immune tumor microenvironment of dermatofibrosarcoma protuberans,Adaptive Immunity in Cancer,4/21/2026 9:00:00 AM,"Maryam Al-Ghezi, Malia Rettig, Christopher P. Loo, Rashi Yadav, Wesley Yu, Joshua M. Moreau","Cell, Developmental and Cancer Biology, Oregon Health & Science University, Portland, OR | Cancer Early Detection Advanced Research Center, Oregon Health & Science University, Portland, OR | Department of Dermatology, Oregon Health & Science University, Portland, OR",Visium,Visium; 10X,https://www.abstractsonline.com/pp8/#!/21436/presentation/1321
10X,1524,4788,"PSMA-expressing tumor vasculature in renal cell carcinoma: spatial, functional, and therapeutic implications",Angiogenesis,4/21/2026 9:00:00 AM,"Ryuta Watanabe, Keito Kagimoto, Mami Chosei, Tomohisa Sakaue, Mie Kurata, Noriyoshi Miura, Riko Kitazawa, Tadahiko Kikugawa, Shigeki Higashiyama, Takashi Saika","Department of Urology, Ehime University Graduate School of Medicine, Toon, Japan | Department of Biochemistry and Molecular Genetics, Ehime University Graduate School of Medicine, Toon, Japan | Department of Cardiovascular and Thoracic Surgery, Ehime University Graduate School of Medicine, Toon, Japan | Department of Analytical Pathology, Ehime University Graduate School of Medicine, Toon, Japan | Division of Diagnostic Pathology, Ehime University Hospital, Toon, Japan | Department of Oncogenesis and Growth Regulation, Osaka International Cancer Institute, Osaka, Japan",Visium,Visium; 10X,https://www.abstractsonline.com/pp8/#!/21436/presentation/1524
10X,10753,4947,Spatially organized transcriptional programs and tumor-stroma interfaces shape immunotherapy response in microsatellite instability-high gastrointestinal cancers,Spatial Niches and Functional Boundaries within the Tumor Microenvironment 1,4/21/2026 9:00:00 AM,"Xueshuai Han, Kohei Yamashita, Melissa Pool Pizzi, Kyung Serk Cho, Enyu Dai, Kai Yu, Yunhe Liu, Yibo Dai, Tian Chu, Matheus Sewastjanow-Silva, Hiro Yoshimura, Yibo Fan, Rebecca Waters, Qiong Gan, Feng Yin, Shilpa S. Dhar, Isadora Martins, Jason Willis, Mariela B. Murphy, Jenny Li, Brian D. Badgwell, Van K. Morris, Michael J. Overman, Linghua Wang, Jaffer A. Ajani","UT MD Anderson Cancer Center, Houston, TX | Gastrointestinal Medical Oncology, UT MD Anderson Cancer Center, Houston, TX",Visium,Visium; 10X,https://www.abstractsonline.com/pp8/#!/21436/presentation/10753
10X,10761,4953,Spatial tissue architecture as a unifying principle of tumor and microenvironmental states in adult gliomas,Spatial Niches and Functional Boundaries within the Tumor Microenvironment 1,4/21/2026 9:00:00 AM,"Anna Mathioudaki, Zaira Seferbekova, Samuel P. Rutz, Michael Ritter, Domenico Calafato, Gleb Rukhovich, Felix Hinz, Philipp Mahlknecht, Franziska M. Ippen, Ekaterina Popova, Sophia Schinkewitsch, Nela Runa Koeberer, Nina Wilhelm, Pooja Sant, Jan-Philipp Malm, Sascha Dietrich, Christel Herold-Mende, Nima Etminan, Antje Wick, Sandro Krieg, Michael Platten, Andreas von Deimling, Felix Sahm, Abigail Suwala, Moritz Gerstung","AI in Oncology, German Cancer Research Center (DKFZ), Heidelberg, Germany | Department of Neuropathology, Institute of Pathology, Heidelberg University Hospital, Heidelberg, Germany | Department of Hematology, Oncology and Clinical Immunology, Medical Faculty and University Hospital Düsseldorf, Düsseldorf, Germany | Department of Neuropathology, Institute of Pathology, University Hospital Heidelberg, Heidelberg, Germany | Single Cell Open Lab, German Cancer Research Center (DKFZ), Heidelberg, Germany | Division of Experimental Neurosurgery, Department of Neurosurgery, Heidelberg University Hospital, Heidelberg, Germany | Department of Neurosurgery, University Hospital Mannheim, Medical Faculty Mannheim (UMM), University of Heidelberg, Mannheim, Germany | Department of Neurology, University Hospital Heidelberg, Heidelberg, Germany | Department of Neurosurgery, Heidelberg University Hospital, Heidelberg, Germany | Clinical Cooperation Unit Neuroimmunology and Brain Tumor Immunology, German Consortium for Translat, German Cancer Research Center (DKFZ), Heidelberg, Germany",Xenium,Xenium; 10X,https://www.abstractsonline.com/pp8/#!/21436/presentation/10761
10X,10765,4957,Spatially resolved profiling of the tumor microenvironment and therapeutic response in SMARCB1-deficient epithelioid sarcoma,Spatial Niches and Functional Boundaries within the Tumor Microenvironment 1,4/21/2026 9:00:00 AM,"Jiayi Fan, Jeffrey Quinn, Wesley Tansey","Computational Oncology, Memorial Sloan Kettering Cancer Center, New York, NY",Xenium,Xenium; Xenium + 5K; 10X,https://www.abstractsonline.com/pp8/#!/21436/presentation/10765
10X,10770,4960,Cross-platform comparison of spatial transcriptomics technologies in an FFPE lung squamous cell carcinoma sample,Spatial Niches and Functional Boundaries within the Tumor Microenvironment 1,4/21/2026 9:00:00 AM,"Bryan Bell, Cedric Uytingco, Alec Barrett, Bryant Ngo, Jonathan Sakkos, Diksha Kool, Wanxin Wang, Melissa del Rosario, Christina Chang, Christina Fan, Andrew Farmer","Takara Bio USA, San Jose, CA",Xenium; Visium,Xenium; Visium; 10X,https://www.abstractsonline.com/pp8/#!/21436/presentation/10770
10X,10772,4962,Spatial transcriptomics reveals distinct ASCL1 and ASCL2 gene expression patterns in advanced prostate cancer,Spatial Niches and Functional Boundaries within the Tumor Microenvironment 1,4/21/2026 9:00:00 AM,"Fan Wei, Joy C. Yang, Kenneth Iczkowski, Marc A. Dall'Era, Chengfei Liu","Department of Urologic Surgery, University of California Davis, Sacramento, CA | Department of Pathology and Laboratory Medicine, University of California Davis, Sacramento, CA",Visium,Visium; 10X,https://www.abstractsonline.com/pp8/#!/21436/presentation/10772
10X,10775,4965,Sarcomatoid transformation rewires the immune spatial landscape and checkpoint regulation in chromophobe renal cell carcinoma,Spatial Niches and Functional Boundaries within the Tumor Microenvironment 1,4/21/2026 9:00:00 AM,"Wafaa Bzeih, Yan Tang, Tiegang Han, Andrew J. Sedgewick, Nathan D. Maulding, Carmen Priolo, Katrina Collins, Hadi Mansour, Joelle Chami, Michelle M. Stein, Justin Guinney, Michel Alchoueiry, Jessica F. Williams, Michelle S. Hirsch, Pavlos Msaouel, Elizabeth P. Henske","Department of Medicine, Harvard Medical School/Brigham and Women's Hospital, Boston, MA | Tempus AI, Inc., Chigaco, IL | Indiana University School of Medicine, Indianapolis, IN | Department of Pathology, Harvard Medical School / Brigham and Women's Hospital, Boston, MA | Genitourinary Medical Oncology, The University of Texas MD Anderson Cancer Center, Houston, TX",Xenium,Xenium; Xenium + 5K; 10X,https://www.abstractsonline.com/pp8/#!/21436/presentation/10775
10X,10558,4995,LAMP3+ migratory dendritic cells establish immune-accessible tumor microenvironment in non-Hodgkin lymphoma,Tumor-Immune Crosstalk,4/21/2026 9:00:00 AM,"Yulong Wei, David Alexander Braun, Ya-Chi Ho","Microbial Pathogenesis, Yale School of Medicine, New Haven, CT | Medical Oncology and Hematology, Yale School of Medicine, New Haven, CT",Xenium,Xenium; 10X,https://www.abstractsonline.com/pp8/#!/21436/presentation/10558
